question,answer
なぜ遠出しなかったのですか？,午後から雨が心配だったため、遠出を避けました。
テキストから、春が近づいていることをどのように感じましたか？,肌で春が近づいているのを感じました。
テキストに登場する「お世話になっているボウリング場」へ行く際、何という道路を越えますか？,着々と整備されている圏央道を越えます。
なぜケンタッキーフライドチキン（ケンタ）に立ち寄ったのですか？,途中でトイレに行きたくなったため、通り道にあったケンタッキーフライドチキン（ケンタ）に変更しました。
エルモサの右目の黒目に斑点が見つかったのはいつ頃ですか？,約1年程前に、エルモサの右目の黒目の端に小さな斑点が見つかりました。
エルモサの右目の黒目の斑点は、どの程度目立ちますか？,よ〜く見ないと分からない程の小さな斑点です。
先生から診断された病名は何ですか？,角膜ジストロフィーという診断を受けました。
エルモサは、どのくらいの期間が経過すると大きくなる傾向がありますか？,エルモサは1年ほど経過すると、徐々に大きくなる傾向があります。
散歩仲間から何か指摘されたことはありますか？,いいえ、これまでお散歩仲間からは指摘されたことはありません。
もし自分から言わなければ、そのことは目立ちますか？,いいえ、自分から言わなければそんなに目立つ程ではありません。
昔処方されていたヒアルロン酸の目薬は効果があるか？,昔ヒアルロン酸の目薬が処方されていたようだが、効果はない。
今回コースにカタクリの花が取り入れられた理由は何ですか？,カタクリの花が５分咲きという情報があったため、コースに取り入れられました。
筆者は今までエルディとの散歩でカタクリの花を見に行ったことがありますか？,いいえ、エルディとの散歩ではカタクリの花を見に行ったことはありません。
なぜ今まで走るのをためらっていたのですか？,陸上部らしき学生が速いスピードで走っているのを見て、怖気づいていたからです。
テキストに登場する人物は何をしたいと思っていましたか？,以前から走ってみたいと思っていました。
話し手が「彼ら」に会いたくない理由は？,会いたくないので、春の外出をこれで終わりにしようと考えている。
この人が「ダイスキ」だと再確認したのはどんなことですか？,自然の中を走ることです。
なぜこの人は自然の中を走るのが苦にならないのですか？,自然の中を走るのが「ダイスキ」だからです。
何が増えることが、背骨の可動域を狭める原因になる可能性があるか？,加齢に伴い増える何らかのものが、背骨の可動域を狭める原因になる可能性がある。
背骨の可動域が狭まると、どのような問題が起こりうるか？,背骨の可動域が狭まると、腰痛などの問題が起こりうる。
銀時にとっての十年は、どのような時間として感じられたと述べられていますか？,銀時にとってその十年は、過ぎてみれば長いようで短かったように感じられたと述べられています。
二人が道を分かつまでの間、共有していた時間はどのくらいですか？,道を分かつまでの二十年弱の期間、二人は多くの時間を共有していました。
最近の十年で、二人はどのような道を歩んできましたか？,最近の十年では、二人は互いに全く知らない道を歩んできました。
この人物は昔からどのような性格だったと述べられていますか？,昔から、いつの間にか道場に上がり込んで周りに馴染むような、人の懐に入り込むのが上手い性格だったと述べられています。
この人物が周りに馴染むのが上手いのはなぜだと考えられますか？,テキストでは、人の懐に入り込むのが上手いからだと示唆されていますが、具体的な理由は明記されていません。
座る際にどのような状態だったため、やや桂寄りに座ることになったか？,丁寧とは程遠い雑さで腰を落ち着けたため、結果としてやや桂寄りに座ってしまった。
テキストにおいて、座る姿勢はどの程度丁寧だったと表現されているか？,テキストでは、座る姿勢は「丁寧とは程遠い雑さ」と表現されており、非常に雑であったことがわかる。
腕が当たるかもしれない距離はどの程度でしたか？,腕が当たるかもしれない微妙な距離でした。
本文で述べられている「かもしれない」という表現は何を示唆していますか？,腕が当たるかどうかは確定的な事実ではなく、あくまで可能性であることを示唆しています。
作中の人物は相手を避けていると言えるか？,作中の人物は相手を避けているとは言えない。なぜなら、会話は普通にするし、相手から会いに来ているからである。
十年ぶりの再会は誰が仕組んだのか？,十年ぶりの再会は桂が仕組んだ。
銀時が「何もしていない」とは、具体的にどのような状況を指しているか？,テキストからは、銀時が特定の行動を起こさなかった状況を指しており、それは避けられない、あるいは最良の選択肢だったと考えられる。
「今思い返しても、あれ以上に最良の選択肢が分からない」と述べていることから、何が推測できるか？,過去の特定の状況において、後悔がない、またはそれ以上の良い選択肢が存在しなかったと考えていることが推測できる。
この発言から、発言者は何をする可能性が高いですか？,発言者は、相手と同じものを注文する可能性が高いです。
成人男性が一人増えることで食卓が大きく変わることに対して、なぜ簡単に決められないのか？,食卓は単に食事をする場所以上の意味を持ち、家族構成の変化は生活全体に影響を与えるため、慎重に検討する必要があるからです。
銀時が桂に対して口で言い負かそうとしない理由は何ですか？,桂には口で言い負かそうとしても通じないと銀時が理解しているからです。
銀時は桂に対して、口と手のどちらが先に出ますか？,銀時は桂の勢いに対して、口よりも先に手が出ます。
桂は銀時に対してどのような態度をとっていますか？,桂は銀時との距離をさりげなく作っています。
桂が頬を膨らませている理由は何ですか？,桂は頬を膨らませて「痛いではないか」と言っているので、何らかの痛みを感じていると考えられます。
銀時は接触を避けられている状況をどう感じているか？,どうしようもないこととは理解しているものの、釈然としない気持ちを抱いている。
銀時は接触を避けられても特に困ることはないと言っているが、それはなぜか？,テキストからは、具体的な理由は明示されていない。接触を避けられても生活に支障がないという意味合いと推測できる。
桂が銀時との接触を避けるようになった原因は何ですか？,十年も前の出来事が原因であると考えられます。
テキストに登場する「男」は、どのような性格だと考えられていますか？,酒宴を開くような性格ではないと思われています。
「男」が夜遅くに「桂」を呼び出したことについて、語り手は何を疑問に思っていますか？,普段酒宴を開くような性格ではない男が、なぜこんな時間に桂を呼び出したのかを疑問に思っています。
このテキストの話し手は何を嘆いていますか？,話し手は、まともな言葉を発することができない自分の頭の悪さを嘆いています。
戦況が苦しい中、金銭的に苦労することが少なくなったのはなぜですか？,坂本という後方支援を得て、金銭的な援助を受けられるようになったからです。
拠点を構える際、攘夷浪士は何をしていましたか？,攘夷浪士は、土地の有力者にあまりいい顔をされませんでした。
戦において地元の人間の協力はなぜ必要不可欠なのですか？,地元の人間の協力がないと、拠点の確保や物資の調達が困難になるからです。
テキストから、当時の戦況はどのような状況だったと推測できますか？,戦況は非常に厳しく、誰もが追い詰められた状況だったと推測できます。
桂が冗談を言わないと判断できる根拠は何ですか？,桂の視線が銀時を真っ直ぐ射抜いており、言葉以上に真剣な意図が伝わるため、冗談ではないと判断できます。
桂の視線は、この文脈においてどのような役割を果たしていますか？,桂の視線は、言葉では表現しきれない彼の真剣な思いや意図を伝える役割を果たしています。
なぜ、テキストの人物は少しでも心が軽くなる方法を選びたいと考えているのか？,これから目的のために、男としての屈辱を自ら味わいに行かなければならないから、少しでも精神的な負担を減らしたいと考えている。
テキストに出てくる「殊勝な考え」とは、具体的にどのような考えを指しているか？,初めての相手は好きな人が良い、という考えを指している。
なぜ「こいつ」は立派な男だと気付いたのか？,相手を好きになるのは男も女も関係ない、という考えに至ったため。
「屈辱的なことをされに行くやつ」に対して、どのような質問をしてしまったのか？,「好いた相手が男なわけがあるまい」という、相手の性的指向を否定するような質問をしてしまった。
桂は何を肯定しましたか？,桂は、皆まで言うことなく肯定しました。
「こいつ」とは誰のことを指しているか？,「こいつ」は話し手にとって大事な幼馴染のことである。
話し手は、なぜ幼馴染が大事であるということを言葉にして伝えなかったのか？,テキストからは、具体的な理由は不明である。しかし、幼馴染という関係性が当たり前すぎて、あえて言葉にする必要を感じていなかった可能性が考えられる。
テキストの主人公は幼馴染の何に混乱しているか？,主人公は、見たことのない大人びた幼馴染の顔に混乱している。
主人公が混乱している理由は何ですか？,主人公は幼い頃の幼馴染の表情しか知らなかったため、大人びた顔つきに変化したことに戸惑っている。
このテキストから、話し手が何かを言う際にどのような行動や感情を伴っていたと推測できますか？,話し手は、大きな想いを抱え、勇気を振り絞り、恥を捨て、覚悟を決めて何かを言ったと推測できます。
テキストは、話し手が「冗談」を言うタイプではないことを示唆していますが、それはなぜですか？,テキストは、話し手が並々ならぬ決意と覚悟を持って発言したことを強調しており、その重みが冗談とは対照的であるためです。
テキストに登場する人物は、誰に対してどのような感情を抱いているか？,テキストの人物は、好きでもない男性に抱かれなければならない女性に対し、酷な状況だと理解しつつ、少しばかり同情している。
テキストから、登場人物が「一度くらい抱いてやれよ」と思う背景にある理由は何だと考えられるか？,好きでもない男性に抱かれる女性への同情と、せめてもの慰めになればという気持ちが、その背景にあると考えられる。
幼少期はどのような髪型をしていたか？,幼少期は高い位置で髪を結んでいた。
最近よく見かける髪型はどのようなものか？,毛先を緩くまとめて横に流す髪型をよく見かける。
この髪は何に例えられていますか？,艶やかで真っ直ぐで汚れを知らないことから、持ち主自身に例えられています。
髪を梳く行為は何に例えられているか？,髪を梳く行為は、祈りを捧げるように例えられている。
なぜ髪を梳く行為が祈りに例えられていると考えられるか？,ゆっくりと時間をかけて、何かを願うように丁寧に行っているからだと考えられる。
なぜ「あれは白昼夢だったのかもしれない」と思ったのか？,最近、敗戦が続いて精神的に参っていたため、現実感が薄れていた可能性がある。
テキストの人物は、今夜どのように過ごそうとしているか？,テキストの人物は、今夜はゆっくり休んで疲れを癒そうとしている。
桂の様子は周りの人から見て変わっていましたか？,テキストによると、桂は何一つ変わった様子がなかったと述べられています。
テキストから、銀時に対する拒否反応の原因としてどのような可能性が考えられますか？,オッサンとの行為のせいで人間不信気味になっている可能性が考えられますが、テキストでは銀時に対してのみ拒否していると述べられています。
テキストにおいて、誰にも触れないという状況でない場合、銀時に対する拒否反応の原因として推測されることは何ですか？,オッサンとの行為のせいで人間不信気味になっていると推測できます。
このテキストは何が原因で起きたことを説明していますか？,桂の想いを銀時が受け入れなかったことが原因で起きたことを説明しています。
倉沢は具体的にどのような行動で疑惑を招いたか？,倉沢は表立って何かを言うことはなかったものの、頻繁に隊士を呼び出すことが疑惑を招く原因となった。
隊士たちの間でどのような噂が流れるようになったか？,隊士たちの間では、倉沢に対する疑惑が事実であるかのように噂されるようになった。
テキストから、リーダーに起こった変化として述べられていることは何ですか？,リーダーは独特の艶のようなものを纏い始めたと述べられています。
クソ真面目なリーダーは、どのような行動をしていたと述べられていますか？,クソ真面目なリーダーは、夜な夜な抜け出していると述べられています。
テキストに登場する男性に、以前と比べてどのような変化があったと述べられていますか？,以前は清廉潔白で傑物だった男性に、抱かれていることを匂わせるような隙が生まれたと述べられています。
男性の変化は、具体的にどのような「何か」を纏うことで表現されていますか？,男性は「男に抱かれているのだと俄かに匂わせる何か」を纏うことで、以前との変化が表現されています。
今日の天気予報で結野アナはどのような注意を促していましたか？,ゲリラ豪雨に注意するよう促していました。
なぜ「俺」は傘を持ってこなかったことを後悔しているのですか？,天気予報でゲリラ豪雨への注意が促されていたにも関わらず、傘を持たずに外出してしまったからです。
このテキストの話し手は、相手のどのような態度に不快感を抱いているか？,話し手は、相手が遠慮なく茶を啜っていることと、偉そうな態度をとっていることに不快感を抱いている。
「引っかかったこと」とは、話し手が相手の態度以外に気になっていることと考えられるが、どのような種類の事柄か？,テキストからは具体的な内容は不明だが、話し手が相手の行動や言動について、さらに疑問や不審感を抱いていることを示唆する。
桂が持っていた傘は何人用ですか？,桂が持っていたのは一人用の傘です。
一人用の傘に成人男性二人が入るとどうなりますか？,肩や腕が触れ合ってしまうでしょう。
銀時は桂の心境の変化について何を知っているか？,銀時は、桂の中で過去の思いがどのように変化したのか、あるいは消えていったのかを知る由もない。
この文脈における「有無を言わさぬ口調」とは、どのような状況を表しているか？,相手の意見や反論を聞き入れず、一方的に物事を進めるような強い口調を指している。
桂が傘から出てしまったのはいつですか？,「なんて馬鹿なことを考えている」と主人公が思っている不意に、桂は傘から出てしまいました。
なぜ「こちらの方がいい」と言えるのか？,豪華な屋敷よりも「らしい」し、銀時としても落ち着くから。
「こちら」とは何を指しているか？,テキストからは具体的な場所や物が特定できないが、豪華な屋敷ではない場所を指している。
縁淵に置かれていた鍵は誰のものだったか？,鍵は桂が懐から取り出したものだった。
テキストで「あいつ」が付けている可能性のあるストラップは、具体的にどのような種類のものとして描写されていますか？,エリザベスなのかステファンなのか分からない得体の知れない何か、と描写されています。
なぜテキストの話し手は「あいつ」が気色の悪いストラップをつけていると考えているのですか？,「どうせあいつのことだから」という表現から、話し手は「あいつ」の性格や趣味を考慮して、そのようなストラップをつけているだろうと推測しています。
目を凝らして探したものは何ですか？,テキストからは、何か特定のものを探していたが、見当たらなかったことがわかります。
探していたものが見つからず、代わりに見つけたものは何ですか？,探していたものは見つからず、代わりにシンプルな紐が括りつけられているのを見つけました。
テキスト中で「私」が見覚えがあることに気付いたものは何ですか？,どんなものだったのかは曖昧だが、過去に触れたことがある何か。
「私」がよく覚えていることは何ですか？,「私」は、その曖昧なものをどうしたのかだけをよく覚えています。
テキストの内容から、何について思い違いかもしれないと言っていますか？,似たような色の紐を、以前の紐だと勘違いしたかもしれないと言っています。
なぜ紐を勘違いした可能性があると考えられますか？,似たような色と装飾の紐だったため、勝手に以前の紐だと思い込んでしまった可能性があります。
テキスト中の人物は、どのような考えに至ったために熱が上がったと感じたか？,テキストからは、具体的な考えの内容は不明。
熱を冷ますために、人物は何をしたか？,頭を振って、急激に上がった熱を冷まそうとした。
なぜ「私」は抗議を口にしかけて止まったのか？,テキストから理由は直接的には述べられていませんが、乱暴な渡し方への抗議をしようとした際に何かを見て、または何かを感じて言葉を飲み込んだと考えられます。
「私」が当てられたと分かっていたものは何か？,「私」が当てられたと分かっていたものはタオルです。
桂はどのような様子でしたか？,桂は小刻みに震え、顔を真っ赤に染め上げていました。
桂は銀時をどこから追い出したか？,桂は銀時を玄関から追い出した。
銀時が追い出された時、雨はどうだったか？,銀時が追い出された時、雨はまだ止んでいなかった。
幼馴染の表情は、いつから変化したように感じられますか？,十年という期間を経て、幼馴染の表情が変化したように感じられます。
なぜ、主人公は幼馴染の表情の変化に驚いているのでしょうか？,今まで見たことのない表情をしていたため、幼馴染がいつの間にそのような表情をするようになったのかと驚いていると考えられます。
戦時中、敵が討ち取ったと喚いていた人物は誰ですか？,桂です。四天王のメンツも同様に狙われていました。
敵はなぜ「桂を討ち取った」と声高に喚いたのですか？,敵の士気を高めるため、または味方を鼓舞するためのプロパガンダの一環と考えられます。
証拠を突きつけられた人物はどのような状態になったか？,証拠を突きつけられた人物は、非常にみっともないほどブチ切れた。
なぜその人物は証拠を突きつけられた際にブチ切れたのか？,テキストからは直接的な理由は不明だが、証拠がその人物にとって不利なものであったと考えられる。
このテキストにおいて、過った時に自覚したことは何ですか？,失ってしまったかもしれないという覚悟がハッタリだったと自覚しています。
このテキストから、どのような感情の変化が読み取れますか？,一時的に失う覚悟をしたものの、実際はそうではなかったことに気づき、自身の覚悟が不十分だったことを痛感する感情の変化が読み取れます。
テキストにおいて、話し手は相手にどのような行動を取ったか？,話し手は相手を強く抱き締めた。
掴んだ腰の細さは、話し手の想像と比べてどうだったか？,想像していたよりもずっと細かった。
腰を掴む際に、話し手が力を加減に不安を感じた理由は何か？,少しでも力を間違えると、本当に腰がもげてしまうのではないかと感じたから。
相手が銀時を押しやろうとしても、まともに力が入っていない理由は何ですか？,傷が痛むため、十分な力が出せないからです。
相手が中途半端に身を捩るだけに留まっている理由は何ですか？,手足をばたつかせると反射で離してしまうかもしれないが、銀時の怪我を悪化させる懸念があるからです。
以前の髪型であれば、指先に何が触れたはずですか？,以前の髪型であれば、指先に毛先が触れたはずです。
なぜ、ざっくばらんに切られた髪が頬を撫でているのですか？,以前と髪型が変わり、短く切られたため、頬を撫でるようになったと考えられます。
このテキストにおける「最後の砦」は何を指しているか？,触れると「最後」になるかもしれないと耐えてきたものが、比喩的に「最後の砦」と呼ばれている。
なぜ「ずっと耐えてきた」と表現されているのか？,触れたら「最後」になるという認識から、何らかの誘惑や危険に対して、長い間抵抗してきたことを示唆している。
桂が「消え入りそうな声で懇願する」状況で、なぜ「俺」は桂を離さないのか？,「俺の気持ちが分かっているのなら」という桂の言葉から、二人の間には強い感情的な繋がりがあり、その気持ちに応えたいから離さないと解釈できる。
なぜ今更伝えることになったのか？,伝える側が今更気付いたからである。
このテキストから、伝えたいことは何だと考えられますか？,これから何十年もかけて伝えていくことである。
借金返済や多重債務の問題は、なぜ自分一人では解決が難しいのですか？,借金問題は複雑な法的、経済的側面を含み、専門的な知識や交渉力が必要となるため、一人で対応するには限界があるからです。
潟上市の人は、どのような相談をインターネットで無料相談できますか？,潟上市の人は、弁護士や司法書士への相談をインターネットで無料相談できます。
潟上市の人が、弁護士や司法書士にインターネットで無料相談するメリットは何ですか？,手軽に相談できるため、問題解決の糸口を見つけやすくなります。
