question,answer
JOYが入院した際、ユージはどのように感じましたか？,JOYが入院した時、ユージは最初少し嬉しい気持ちもありましたが、1週間ほどすると戦う相手がいないので自分を見失いそうになったと述べています。
JOYが入院中、ユージの活躍を見てどのように感じましたか？,JOYは休んでいる間、ユージが頑張っているのを見ていたと述べています。
ユージとJOYの関係をキャプテン・アメリカとレッドスカルに例えることについて、ユージはどう思っていますか？,ユージは、JOYが提案したキャプテン・アメリカとレッドスカルのような関係であるという例えを否定しています。
ユージが語るキャプテン・アメリカの人物像とは？,特殊能力がなく生身で戦い、攻めるだけでなく守る戦いをする、みんなのために何かができる真のヒーロー。
ユージはなぜ“和製キャプテン・アメリカ”と呼ばれるのか？,キャプテン・アメリカの人物像について的確なコメントをしたことから、そう呼ばれている。
キャプテン・アメリカとレッド・スカルの戦いは、ユージとJOYの関係性とどう違うか？,ユージとJOYの関係性は和やかだが、キャプテン・アメリカとレッド・スカルの戦いは壮絶である。
JOYは誰を守りたいと言ったか？,JOYはAKBの高橋みなみのような女性を守りたいと言った。
なぜJOYの発言で会場の雰囲気が一気に笑いに変わったのか？,JOYの発言が、ユージの真面目なコメントに被せたため、場を和ませるユーモアとして受け止められた。
『キャプテン・アメリカ/ザ・ファースト・アベンジャー』はいつから公開される？,2011年10月14日(金)から丸の内ルーブルほか全国で公開されます。
『キャプテン・アメリカ/ザ・ファースト・アベンジャー』はどのような形式で公開される？,全国超拡大3Dロードショ−形式で公開されます。
記事では、誰がイケメンマッチョに変身する実験を行ったと述べられていますか？,上島竜兵が出川に負けないために極秘実験でイケメンマッチョに変身したと述べられています。
アメコミ・ヒーローが派手なコスチュームを着用する理由は何ですか？,記事には「スーパーヒーローが派手なコスチュームを着用する意外な理由」という記述がありますが、具体的な理由は記載されていません。
記事で比較されているヒーローの種類は？,歴代アメコミ・ヒーローが比較されており、特に原点ヒーローである“キャプテン・アメリカ”の実力が測られています。
この番組の魅力は何ですか？,究極的には、型にはまったFBIエージェントと向こう見ずな詐欺師という、普通ではあり得ない人間関係を描いている点です。
FBIエージェントと詐欺師の関係性はどのように変化しますか？,敵対者でありながら、究極的にはお互いを尊敬し合う関係へと変化していきます。
この番組が常に新鮮で興味深いのはなぜですか？,ふたりの関係性の間にあるエネルギーが、物事を常に新鮮で興味深いものにしているからです。
マット・ボマーが演じる役の名前は何ですか？,ニール・キャフリー役を演じています。
この番組では、どのような立場の二人が描かれていますか？,型にはまったFBIエージェントと向こう見ずな詐欺師という、通常では考えられない立場の人々が描かれています。
マット・ボマーがニールの役作りで参考にした映画は何ですか？,『泥棒成金』、『スティング』、『フェリスはある朝突然に』、『キャッチ・ミー・イフ・ユー・キャン』などが参考になったと述べています。
ニールのキャラクターの特徴は何ですか？,大きな子供のようなところがあり、完全には大人になりきっていない衝動的な行動をする人物であり、自分自身に正直であるところが特徴です。
マット・ボマーがニール役を演じる上で最初に行ったことは何ですか？,クリエイターのジェフ・イースティンと、情報源となる資料を読み、役柄の参考となるものについて話し合いました。
ニールのキャラクターが「フェリスはある朝突然に」から影響を受けているのはどのような点ですか？,ニールのキャラクターには、主人公のフェリスのような大きな子供のようなところがあり、完全に大人になりきっていない点が共通しています。
フランク・W・アバグネル・Jr.がニールの役作りにどう影響を与えたか。,フランク・W・アバグネル・Jr.の詐欺師としての才能や、人を惹きつける魅力がニールの役作りの参考になったと考えられます。
ニールのファッションは誰のアイディアが始まりでしたか？,ニールのファッションはJeffのアイディアから始まり、それをマット・ボマーとJeffの二人で微調整しました。
ニールのファッションに大きく影響を与えたのはどのような集団ですか？,ニールのファッションには、1950年代の俳優仲間であるラット・パックが大きく影響を与えました。
ラット・パックの代表的なメンバーは誰ですか？,ラット・パックの代表的なメンバーは、ハンフリー・ボガード、フランク・シナトラ、サミー・デイヴィス・Jr.などです。
ニールの人間像は、主にどの年代の人々に影響を受けていますか？,ニールの人間像は、60年代のフランク・シナトラやディーン・マーティンといった人々に大きく影響を受けています。
ニールのファッションの特徴的なアイテムは何ですか？,ニールのファッションの特徴的なアイテムは、テーパード・スーツや身体にフィットしたスーツです。
マット・ボマーが番組を成功させる上で感じているプレッシャーの種類は何ですか？,マット・ボマーは、番組を成功させる上で常にプレッシャーの増大を感じており、それは仕事上当然のことだと捉えています。
マット・ボマーが番組をアンサンブルだと考えている理由は何ですか？,番組の成功には、すべての要素が正しく組み合わさることが不可欠であり、一つでも欠けると全体が完成しないと考えているためです。
マット・ボマーが自身の向上に繋がると感じている要因は何ですか？,素晴らしい脚本家と共演者に恵まれていることが、彼自身の向上に繋がると感じています。
もしあなたがチームで仕事をする際に、マット・ボマーの考え方を応用するとしたら、どのような点に注意しますか？,チーム全体のバランスと各メンバーの役割を重視し、一人ひとりが適切に機能することで、全体の成功に繋げることを意識します。
マット・ボマーにとって、番組における「アンサンブル」とはどのような意味ですか？,番組のすべての要素が相互に連携し、一つでも欠けると全体が完成しないような、一体感のある構成要素を指します。
マット・ボマーが演じる役柄の設定は何ですか？,二枚目のエージェントという設定です。
マット・ボマーは自分のルックスが良いことにいつ気付きましたか？,彼は未だにそれを待っていると言っています。
マット・ボマーがニール・キャフリーというキャラクターに皆が惹かれることを嬉しく思う理由は何ですか？,彼には兄がいて、歳上の兄弟は弟をカッコいいと思わせないようにするものだからです。
二枚目であることは、マット・ボマーにとって役をもらう上で有利になることもありますか？,彼は笑って、有利にも重荷にもなり得ると答えています。
番組制作においてプレッシャーよりも大きいものは何ですか？,最高に楽しいということです。
俳優という職業において、コントロールできないことの方が多いのはなぜですか？,俳優の仕事は主観的な判断に左右されやすく、最終的な評価は他者に委ねられるため、自身でコントロールできる範囲が限られているからです。
俳優ができることは何ですか？,俳優ができることは、出演作品で演じるキャラクターを深く理解し、その表現に全力を注ぐこと、そして観客に気に入ってもらえるように願うことだけです。
俳優業において、コントロールできないこと以外に重要な要素は何ですか？,俳優業において、コントロールできないこと以外に重要な要素は運命です。
ニール・キャフリーとサラ・エリスの関係性はどのようなものだと考えられますか？,ニール・キャフリーとサラ・エリスの関係性はすごく大人の関係です。
俳優が役から外される理由は何ですか？,俳優が役から外される理由としては、場合によっては何らかの理由で役柄に合わなくなることや、求められているイメージと異なると判断されることが挙げられます。
詐欺師の世界に親密な関係性が存在しない理由は何ですか？,詐欺師の世界は移り変わりが早く自由であり、一か八かの世界であるため、親密な関係性が存在しにくいです。
彼はヒラリーのどんな点を尊敬していますか？,彼はヒラリーの知性と、彼女が自立した女性である点を尊敬しています。
ヒラリーは彼から何を必要としていないのですか？,ヒラリーは彼から何も必要としていません。
彼らは互いのどんな点を理解し合っていますか？,彼らは、どんな世界からお互いやってきたのかということを理解し合っています。
彼らの関係は今後どのように発展していくと予想されますか？,彼らの関係は今後、発展し、より親密なものになっていくと予想されます。
ニールはなぜ親密な人間関係を苦手としているのか？,ニールは親密な人間関係を苦手としており、とりわけケイトが最近亡くなったことが理由として挙げられる。
マット・ボマーにとって、ティム・ディケイと仕事をすることはどのような感じか？,マット・ボマーにとって、ティム・ディケイと仕事をすることは、子供の頃のように思い切り遊ぶような感覚である。
マット・ボマーがティム・ディケイと初めて共演した時、どのようなことがあったか？,初めて共演した時、二人の間に強烈なエネルギーがあり、お互いを理解し合えているように感じ、ユーモアのセンスも似ていた。
マット・ボマーは、ティム・ディケイとの共演を、どんな子供時代の状況に例えているか？,遊びを止めたくなくて、母親が夕ご飯のために家に帰るよう５回呼んでも聞かない状況に例えている。
もしあなたが、共演者とすぐに打ち解ける必要がある場合、マット・ボマーとティム・ディケイの関係から何を学ぶことができるか？,強烈なエネルギーを感じること、お互いを理解し合える感覚を持つこと、ユーモアのセンスが似ていることなど、共通点を見つけることが重要である。
マット・ボマーは、ニールのように自分を犠牲にすることはできますか？,マット・ボマーは、自分を犠牲にしてもよいと思える人がたくさんいるし、そう思えるものもたくさんあるため、自分を犠牲にすることは構わないと述べています。
マット・ボマーが自分を犠牲にすることを躊躇する唯一のことは何ですか？,マット・ボマーは、アンクル・ブレスレットだけは嫌だと述べています。それはあまりに縛られすぎるからだそうです。
マット・ボマーにとって、ニールとの時間はどのようなものですか？,マット・ボマーにとって、ニールとの時間は会った瞬間からいつも最高だと語っています。
重苦しいシーンを撮影する際に、マット・ボマーにとってニールとの時間が最高である理由は何ですか？,テキストからは、重苦しいシーンを撮影する際にニールとの時間が最高である直接的な理由は明確に述べられていません。ただ、全体を通してニールとの共演が常にポジティブな経験であることが示唆されています。
マット・ボマーにとって、自分を犠牲にすることとアンクル・ブレスレットを避けることの間にはどのような優先順位がありますか？,マット・ボマーは自分を犠牲にすることは構わないが、アンクル・ブレスレットは嫌だと述べており、自由を束縛されることを避ける方が優先順位が高いと考えられます。
映画『おかえり、はやぶさ』は、何を基につくられた映画ですか？,小惑星探査機「はやぶさ」の地球への帰還という偉業を基に作られました。
映画で藤原竜也が演じる役は何ですか？,父への葛藤を抱えるJAXAエンジニア助手・大橋建人を演じています。
映画で杏が演じる役は何ですか？,宇宙への憧れを追い求める理学博士・野村奈緒子を演じています。
藤原竜也が、はやぶさや宇宙空間に興味を持ったのはいつ頃からですか？,すごく小さい頃から興味を持っていました。
藤原竜也は台本を読んだ際、はやぶさの何に興味を持ちましたか？,はやぶさの事と宇宙空間そのものに非常に興味がありました。
杏が映画化と撮影参加を喜んだ理由は何ですか？,はやぶさ帰還のニュースを見ていた1年後に、映画化されて撮影に参加できるとは思っていなかったからです。
藤原さんが、はやぶさ帰還のニュースをリアルタイムで見た時の感想は何ですか？,多くの方が諦めかけた時期もあったと思うが、日本に大きな希望を運んできてくれたと感じました。
杏さんは元々宇宙に興味がありましたか？,はい、杏さんは元々宇宙にすごく興味がありました。
藤原さんが、はやぶさの映画企画を良いと思った理由は何ですか？,純粋に面白いと思ったことと、日本が成し遂げた素晴らしいことを多くの人に知ってもらいたかったからです。
藤原さんが、映画の共演者について興味を持った理由は何ですか？,杏、三浦、旺志郎など、初めて共演する人が多かったので、面白くなるのではないかと興味を持ったそうです。
藤原氏は、映画出演にあたり、資料を見て何を知りましたか？,大きなドラマや奇跡があったことを改めて知りました。
撮影に入るまで藤原氏が知らなかったことは何ですか？,本には描かれていない、大変な苦労やみんなの思いを知らなかったと述べています。
映画制作において、資料調査の重要性は何ですか？,資料調査を通して、ドラマや奇跡といった物語の背景にある事実を深く理解することができます。
もしあなたが映画監督で、史実に基づいた映画を制作するとしたら、どのような準備をしますか？,徹底的な資料調査を行い、文献に記載されていない関係者の苦労や思いも深く理解するように努めます。
漫画『モテキ』はいつからいつまで連載されていましたか？,2008年11月から2010年4月にかけて講談社「イブニング」で連載されていました。
BeeTVで配信されているBeeマンガ『モテキ』は、どのくらいのダウンロード数を突破しましたか？,Beeマンガ『モテキ』は、500万ダウンロードを突破しました。
『モテキ』の主人公である藤本幸世はどんな人物ですか？,藤本幸世は、三十路間近のモテない派遣社員です。
漫画『モテキ』のストーリーの始まりはどのような状況ですか？,主人公の藤本幸世に、派遣先の元同僚や女友達など、知り合いの女性たちから次々と連絡が入り、「モテ期」が始まります。
漫画『モテキ』の累計発行部数はどのくらいですか？,コミックは累計200万部を突破しています。
ドラマ版『モテキ』の主演俳優は誰ですか？,森山未來が主演を務めました。
映画版『モテキ』の興行収入はいくらですか？,興行収入は21億円を突破しました。
BeeTVで配信された『モテキ』はどのような形式ですか？,声優による台詞やSE、エフェクトを追加したムービーコミックとして配信されました。
BeeTV版『モテキ』で主要キャラクターを演じた声優は誰ですか？,浅沼晋太郎、喜多村英梨、沢城みゆきなどが主要キャラクターを演じました。
BeeTV会員限定で無料プレゼントされた『モテキ』特製待受は誰が書き下ろしましたか？,久保ミツロウが直々に書き下ろしました。
Beeマンガ「モテキ」の主人公、藤本幸世役を演じているのは誰ですか？,浅沼晋太郎が藤本幸世役を演じています。
Beeマンガ「モテキ」で、土井亜紀役を演じている声優は誰ですか？,喜多村英梨が土井亜紀役を演じています。
Beeマンガ「モテキ」の主題歌のタイトルは何ですか？,主題歌は『Good Bye Present』です。
Beeマンガ「モテキ」は毎週何曜日に更新されますか？,毎週金曜日に更新されます。
Beeマンガ「モテキ」は何話までありますか？,全33話です。
映画『ピラニア リターンズ』はいつ公開される？,2012年7月14日に公開される。
『ピラニア リターンズ』はどんな映画の続編？,『ピラニア リターンズ』は『ピラニア3D』の続編である。
なぜ『ピラニア リターンズ』は“映画良識者”に黙殺されると言われている？,そのおバカさと過激さが理由である。
『ピラニア3D』は、どの映画雑誌で2011年度ベスト1に選ばれた？,「映画秘宝」で2011年度ベスト1に選ばれた。
『ピラニア リターンズ』は、前作からどれくらいの時間が経過した後の物語？,古代ピラニアたちがスプリング・ブレイクを襲ってから1年後の物語である。
ピラニアはなぜビッグ・ウェットに辿り着いたのですか？,湖が封鎖されたため、ピラニアは新しい住処を探して旅立ち、ビッグ・ウェットに辿り着きました。
ビッグ・ウェットはどのような場所ですか？,ビッグ・ウェットは、能天気な若者たちが集うために新設されたエッチな仕掛け満載のウォーター・パークです。
前作『ピラニア3D』の売りの一つは何でしたか？,前作の売りの一つは、乱舞するセクシーギャルたちやお色気露出シーンでした。
今回の舞台となるビッグ・ウェットの特徴は何ですか？,今回の舞台はただのウォーターパークではなく、エッチな仕掛けが満載です。
ピラニアの大群によって、ビッグ・ウェットで何が起きましたか？,ピラニアの大群が、この世の楽園であるビッグ・ウェットを地獄へと一変させる惨劇が起きました。
『ピラニア リターンズ』には、子供や若者向けのプール以外にどのようなプールが登場しますか？,大人専用のトップレス美女が常に泳ぐ“アダルトプール”が登場します。
米Esquire誌で2011年度“生存中最もセクシーな女性”No1.に選ばれたのは誰ですか？,カトリーナ・ボーデンです。
前作と比較して、『ピラニア リターンズ』で大幅にパワーアップしている点は何ですか？,前作でおざなりになっていたお色気パートが大幅にパワーアップしています。
『ピラニア リターンズ』は、どのような層に向けた映画ですか？,大人のための18禁アトラクション映画です。
『ピラニア リターンズ』と前作の大きな違いは何ですか？,本作と前作の大きな違いは、その作風です。具体的にはコメディに徹した演出が強化されています。
本作『ピラニア』シリーズは前作と比べてどのような方向性になっているか？,本作は前作と異なり、コメディやアトラクション映画的な方向へ向かっている。
本作の制作陣の中心人物は誰か？,ジョン・ギャラガー、マーカス・ダンスタン、パトリック・メルトンの3人組が中心である。
制作陣が本作で最も重視している点は何か？,登場人物をいかに馬鹿げた方法で殺すか、という点に尽きる。
本作で特に注目すべき点は何か？,ピラニアに食い殺される登場人物たちの、バリエーション豊かな馬鹿げた死に様である。
本作では前作に比べてピラニアはどのように変化しているか？,ピラニアは前作以上にパワーアップしている。
映画に登場するピラニアの種類にはどのようなものがありますか？,小型ピラニア、空中を飛ぶピラニア、人間の頭を食いちぎる巨大ピラニアなどが登場します。
なぜこの映画は「爆笑するしかない」と言われていますか？,登場人物のありえない死にっぷりが描かれているためです。
この映画はどのような伝統的な演出を踏襲していますか？,モンスターパニックの王道である、“リア充な嫌な奴”から順番に死んでいくという演出を踏襲しています。
この映画はどのような人に優しいテイストに仕上がっていますか？,リア充爆発を望む独身男性に非常に優しいテイストに仕上がっています。
映画を観る以外に、リア充の爆発を楽しむためにはどうすれば良いですか？,男同士でビーチに行くよりも、この映画を観て楽しむのがおすすめです。
クリストファー・ロイドは何の専門家として映画に登場しますか？,クリストファー・ロイドはピラニア専門家として映画に登場します。
ヴィング・レイムスは映画の中でどのような設定で再登場しますか？,ヴィング・レイムスは足だけピラニアに食われたという設定で再登場し、義足に仕込んだショットガンを乱射します。
ディヴィッド・ハッセルホフは何役で映画に登場しますか？,ディヴィッド・ハッセルホフは本人役で映画に登場します。
ディヴィッド・ハッセルホフは映画の中で何の役柄をパロディ化していますか？,ディヴィッド・ハッセルホフは映画の中で「ベイウォッチ」の役柄を自らパロディ化しています。
なぜディヴィッド・ハッセルホフの登場は強烈な印象を残すのですか？,ディヴィッド・ハッセルホフは本人役で登場し、「ベイウォッチ」の役柄をパロディ化し、歌まで披露しているため、強烈な印象を残します。
映画『ピラニア リターンズ』には、どの作品で悪役として知られる俳優が出演していますか？,ゲイリー・ビジーがちょこっと登場します。
『ピラニア リターンズ』の映画ファンにとって注目すべき点は何ですか？,懐かしの面々が復活しているところです。
『ピラニア リターンズ』はどのような要素が混ざり合っている映画ですか？,エロス、バイオレンス、笑いが渾然一体となっています。
『ピラニア リターンズ』はどのような人におすすめですか？,部屋に閉じこもってビーチに行かない人にこそおすすめです。
『ピラニア リターンズ』は、どのようなデートに向いていないと言われていますか？,女性とのデートには決して向いているとは言えません。
映画『ピラニア リターンズ』の日本での公開日はいつですか？,2012年7月14日より、ヒューマントラストシネマ渋谷ほか全国で順次ロードショーです。
