question,answer
事務所への直接相談と比較して、ネット無料相談の利点は何ですか？,ネットの無料相談は、事務所へ直接出向くよりも、落ち着いて相談できるという利点があります。
事務所への直接相談ではなく、ネットの無料相談を選ぶ理由は？,落ち着いて相談できる環境を重視する場合、ネットの無料相談の方が適している可能性があります。
このテキストは何を紹介していますか？,潟上市に対応している法律事務所・法務事務所を紹介しています。
借金問題解決のためにまず何をすべきですか？,弁護士や司法書士に相談することが、借金問題解決への第一歩です。
なぜ借金問題を一人で悩むより、専門家に相談することが重要ですか？,専門家は法的知識や解決策を持っており、適切なアドバイスやサポートを提供できるからです。
潟上市の人は、全国対応の法律事務所・法務事務所のサービスを利用できますか？,はい、全国対応なので潟上市に住んでいる人も安心して利用できます。
全国対応の法律事務所・法務事務所のサービスが、地方在住者にとって利用しやすい理由は何ですか？,場所に関わらずサービスを受けられるため、地方に住んでいても都市部の事務所と同じように利用できるからです。
潟上市には弁護士や司法書士の事務所は存在しますか？,はい、潟上市には複数の弁護士や司法書士の事務所が存在します。
潟上市で法律相談をしたい場合、どこに相談するのが良いか？,潟上市にある地元の法律事務所や法務事務所に直接相談するのが良い。
結婚している人が、親や親戚に頼ることが難しい場合、他に誰に頼るのが難しい状況ですか？,配偶者に秘密にしておきたい場合、さらに頼れる人がいなくなって困る状況になりやすいです。
頼れる親族がいる状況と、配偶者に秘密にしたい状況では、どちらが金銭的に困窮しやすいですか？,配偶者に秘密にしたい状況の方が、頼れる人が限られるため、金銭的に困窮しやすいと考えられます。
お金を借りた場合、完済が大変になる原因は何ですか？,借りた額が大きいことと、利子が高いことが原因で、完済が困難になることがあります。
お金を借りた場合、返済義務は誰にありますか？,お金を借りたのは自分の責任なので、返済義務は借りた本人にあります。
返済方法が思いつかない場合、どこに相談すべきですか？,法律事務所や法務事務所に相談すべきです。
法律事務所や法務事務所に相談する理由は？,返済方法が見つからない場合に、専門家からのアドバイスやサポートを受けるためです。
返済金額が減額される可能性は何ですか？,過払い金を請求することで、返済金額が減額される可能性があります。
借金の返済計画はどのようになる可能性がありますか？,借金の返済は、長期計画での返済になる可能性があります。
潟上市で任意整理や債務整理について相談できる専門家は？,弁護士や司法書士に相談できます。
潟上市で任意整理や債務整理の無料相談はいつでも可能ですか？,365日・24時間受付可能な相談事務所があります。
このテキストの主題は何ですか？,このテキストは、東京電力・福島第一原子力発電所事故後の「世界」について考察するものです。
このテキストはシリーズの一部ですか？,はい、このテキストは「第183信」とあり、シリーズの一部であることが示唆されています。
テキストの筆者が食事をする場所を見つけるために行ったことは何ですか？,インターネット検索を重ねて食事をする場所を探しました。
筆者はなぜ食事をする場所を見つけるのが困難だったのですか？,テキストからは、食事をする場所を見つけるのが困難だった理由を具体的に特定することはできません。
レストラン《Ｍ》は、具体的にどのような点で世界最高だと評価されていますか？,素材、調理、接客、施設のいずれの点においても、他の有名なレストランを凌駕していると評価されています。
レストラン《Ｍ》は、ロンドンにあるどのレストランよりも優れていると述べられていますか？,ロンドンのピカデリーサーカス外れの《Ｔ》と、チョーク・ファーム地区の《Ｍ》よりも優れていると述べられています。
レストラン《Ｍ》はどのような種類のレストランと評価されていますか？,レストラン《Ｍ》は“世界最高の自然食レストラン”と評価されています。
このテキストで示唆されている「本来、飲食店のあるべき姿」とはどのようなものですか？,単に自然食レストランであるだけでなく、飲食店が本来持つべき姿のことです。
12月に店を訪れた際、見送りには何人が出てきたか？,店長を含む4名が店の外に出て見送ってくれた。
店のスタッフは、客が帰る際どのような対応をしたか？,店のスタッフは、客が運転する車がいつまでも見えなくなるまで見送った。
テキストは何について述べていますか？,21世紀初頭の東京電力・福島第１原発事故下の日本で生きた人々について述べています。
テキストは何が委譲されるものではないと述べていますか？,テキストは、「世界」がこれまでの祖先たちと同様には委譲されるものではないと述べています。
テキストは何がほどなく滅びるものかもしれないと述べていますか？,テキストは、「世界」が事と次第によっては、ほどなく滅びるものかもしれないと述べています。
テキストに登場する人物の両親は何歳ですか？,父親は87歳、母親は80歳です。
テキストに示されている「世界」とは、どのような状態の世界ですか？,それは修復され、蘇生した姿を見ることが、現在生きている人々には叶わないかもしれない世界です。
なぜテキスト中の「世界」の修復された姿を、現在の私たちは見ることができないと考えられているのですか？,テキストからは明確な理由は示されていませんが、世界の修復には非常に長い時間がかかるか、あるいは不可能なのかもしれません。
世界は何から成り立っていると述べられていますか？,世界は常に極限的な細部の集積から成り立っていると述べられています。
筆者が現在執筆している場所はどこですか？,筆者は現在、東京ではなく、長野県北部の田舎町で執筆しています。
筆者が長野県北部の田舎町に来訪する理由は何ですか？,筆者は事情があって、時折り中央高地である長野県北部の田舎町に来訪します。
この文章がアップロードされるのはいつ頃だと考えられますか？,帰京後になるだろうと推測できます。
