question,answer
『ピラニア リターンズ』は、映画評論家のフジモトによってどのように評価されていますか？,カルト映画として評価されています。
『ピラニア リターンズ』のHot!ワードは何ですか？,「エロス＆バイオレンス」です。
記事では、なぜ『ピラニア リターンズ』を鑑賞することが夏のアトラクション代わりになると言っているのですか？,プールや海に行かなくても、映画を見ることで夏らしい刺激的な体験ができるからです。
この記事における『ピラニア リターンズ』のHot!度はいくつですか？,★★★★★（星5つ）です。
『ベルセルク 黄金時代篇II ドルドレイ攻略』はいつ公開されたか？,2012年6月23日に公開されました。
ガッツが鷹の団を退団を決意した理由は何ですか？,グリフィスから対等の友になることを示唆されたことが理由です。
『ベルセルク 黄金時代篇II ドルドレイ攻略』は、映画シリーズの何作目にあたりますか？,2作目にあたります。
物語の舞台となっている国とその敵国は何ですか？,ミッドランド王国と敵国チューダー帝国です。
『ベルセルク 黄金時代篇II ドルドレイ攻略』では、ガッツは鷹の団に入団して何年が経過していますか？,3年が経過しています。
グリフィスは鷹の団だけで出陣することを誰に進言したか？,グリフィスは鷹の団だけで出陣することを国王に進言した。
ガッツは鷹の団を去ることをいつ決意したか？,ガッツは、ある戦いを最後に鷹の団を去る決意を固めた。
映画『ベルセルク 黄金時代篇II ドルドレイ攻略』は、原作コミックのどの部分を映画化したものか？,本作は、原作コミックの“黄金時代”を映画化した2作目である。
映画『ベルセルク 黄金時代篇II ドルドレイ攻略』の映像制作を担当したスタジオはどこか？,映像はSTUDIO4℃が手掛けている。
鷹の団が出陣した戦いの敵と味方の兵力差はどれくらいか？,敵は3万、味方は5千であり、敵の方が圧倒的に多い。
映画『ベルセルク 黄金時代篇』の映像表現で目指していることは何ですか？,日本アニメーションの最高峰表現を目指し、手描きとデジタルのハイブリッド映像を追求しています。
公開されたポスタービジュアルには、誰とのどのような関係を象徴するコピーが書かれていますか？,ガッツにとって最愛の友となった鷹の団の団長グリフィスとの決闘と別れを象徴するコピーが書かれています。
映画『ベルセルク 黄金時代篇II ドルドレイ攻略』はいつ公開されますか？,2012年6月23日（土）に公開されます。
映画『ベルセルク 黄金時代篇』の制作において重視されている点は何ですか？,徹底した時代考証と美術設定の裏づけ、そして迫力のある戦闘描写が重視されています。
ポスタービジュアルはいつから映画館に掲出されますか？,3月17日から全国の映画館に掲出される予定です。
映画『ベルセルク 黄金時代篇II ドルドレイ攻略』の公式サイトはありますか？,はい、あります。
映画『ベルセルク』のエンディング曲は誰が担当しましたか？,AIが担当しました。
『ベルセルク』の気持ち悪い「金環食観測メガネ」とは何ですか？,記事で取り上げられている関連グッズです。
2012年に公開された劇場版『ベルセルク』は面白いと評価されていますか？,記事のタイトルから、劇場版『ベルセルク』の面白さについて議論されていることがわかります。
ベルセルク黄金時代篇は全部で何部作で映画化された？,三部作で映画化されました。
映画『ベルセルク 黄金時代篇II ドルドレイ攻略』はいつ公開された？,23日に全国公開されました。
『ベルセルク 黄金時代篇II ドルドレイ攻略』の舞台挨拶はどこで行われた？,新宿バルト9にて行われました。
『ベルセルク 黄金時代篇II ドルドレイ攻略』で監督が最も苦労したシーンは何？,ドルドレイ攻略のシーンに三か月ほどかかり、非常にやっかいだったそうです。
岩永洋昭さんは舞台挨拶で何と発言しましたか？,10000キロカロリーくらい消費したと発言しました。
原作者の三浦建太郎先生が初号試写を見た後に喜んだエンターテインメントの基本は何ですか？,セックスとバイオレンスです。
岩永洋昭さんが演じた劇中の100人斬りのシーンは、ガッツにとってどのような意味を持つ場面ですか？,ガッツを象徴するような大事な場面です。
100人斬りのシーンで、岩永洋昭さんは何にこだわって演技をしましたか？,力強さだけでなく、一斬り一斬りのシーンの中にガッツの中にある憎しみや悲しみを込めることにこだわりました。
櫻井孝宏さんは、今回のグリフィスについてどのような様子が劇的に描かれていると述べていますか？,栄光の頂点から転落への様子が劇的に描かれていると述べています。
岩永洋昭さんは100人斬りのシーンを終えて、声優の演技についてどう感じましたか？,声だけでここまで表現できる声優さんは本当にすごいと尊敬の念を抱きました。
『ベルセルク 黄金時代篇II ドルドレイ攻略』は現在どうなっていますか？,絶賛公開中です。
行成とあにとって、キャスカ役はどのような現場でしたか？,これまで以上の演技ができる可能性を感じ、もっとやりたいと思える現場だったと述べています。
『ベルセルク 黄金時代篇』パートIIは三部作の中でどのような位置づけですか？,非常に重要な位置を占める作品だと述べられています。
監督は行成とあに、キャスカ役に決まったいつからどのようなことを言っていましたか？,一年前から「パートIIIは頑張って」と言われていたそうです。
ムービーエンターの特集では、どのような企画がアップされていますか？,WEB GAME BOOKが特別企画でアップされています。
映画『ベルセルク 黄金時代篇III 降臨』はいつ公開されますか？,今年の冬に公開予定です。
映画『ベルセルク 黄金時代篇III 降臨』に向けて、どのような準備が推奨されていますか？,ゲームブックに挑戦して予習し、公開中の映画を観賞することが推奨されています。
現在特集されている映画のタイトルは何ですか？,『ベルセルク 黄金時代篇II ドルドレイ攻略』が特集されています。
なぜ『ベルセルク 黄金時代篇III 降臨』の公開に向けて備えをする必要があるのですか？,『ベルセルク 黄金時代篇III 降臨』はクライマックスの“蝕”を描いており、内容をより深く理解するために備えが必要です。
『ベルセルク 黄金時代篇II ドルドレイ攻略』について、何を確認できますか？,公式サイトで詳細を確認できます。
小森純が出席したイベントは、何の映画の公開記念イベントですか？,映画『グレイヴ・エンカウンターズ』の公開記念イベントです。
『グレイヴ・エンカウンターズ』の予告編が“怖すぎる”と話題になった動画投稿サイトはどこですか？,Youtubeです。
『グレイヴ・エンカウンターズ』の予告編の再生数はどのくらいですか？,2200万回を超えています。
「恐怖のグレイヴ顔アプリ」で生成された恐ろしい顔のビジュアルは誰でしたか？,小森純でした。
映画『グレイヴ・エンカウンターズ』はどのような内容の作品ですか？,心霊番組の撮影スタッフが、廃墟となった精神病院で超常現象に遭遇するモキュメンタリーです。
小森が特殊メイクをした際、何が怖かったですか？,グレイヴ顔の特殊メイクをした自分の顔を見るのが怖く、トイレに一人で行けなかったと述べています。
小森はホラー映画が好きですか？,もともとホラー映画が苦手ですが、「気合で」作品を鑑賞したと述べています。
小森の夫は何と言ったのですか？,夫は小森に対し、「俺、2、3年後には、たぶん浮気するから」と言ったと明かしました。
小森は夫の浮気についてどのように考えていますか？,浮気については割り切っており、感覚的に自由にしているから男の人はそういうものだと考えていると述べています。
小森は夫のことをどのように表現していますか？,「皆さんが思っている以上に、（夫は）クソチャラですからね」と表現しています。
小森はイベントでどのようなアプリを使用したか？,小森はイベントで「恐怖のグレイヴ顔アプリ」を使用した。
小森は夫への愛についてどのように語ったか？,小森は夫への愛が薄れてきたと率直に語り、人としては好きだが一年経つと変わるものだと述べた。
小森は離婚についてどのようなイベントをすると宣言したか？,小森は離婚する際にはPRイベントをすると宣言した。
小森は夫婦関係について、過去のどのような騒動を引き合いに出したか？,小森は塩谷瞬の二股騒動を引き合いに出し、自由な夫婦関係について語った。
なぜ小森の事務所は焦っているのか？,小森自身が、夫への愛が薄れてきたと発言しているため、事務所が焦っている。
映画『グレイヴ・エンカウンターズ』の全国ロードショー開始日はいつですか？,2012年6月1日（金）からです。
映画『グレイヴ・エンカウンターズ』はどこで上映されますか？,TOHOシネマズ六本木、シネマサンシャイン池袋などで上映されます。
『グレイヴ・エンカウンターズ』に関する情報が得られる公式サイトはありますか？,はい、公式サイトと特集ページへのリンクがあります。
もしあなたが映画館の支配人なら、『グレイヴ・エンカウンターズ』の宣伝のためにどんな戦略を立てますか？,公式サイトや特集ページへのQRコード掲載、SNSでの口コミキャンペーンなどを実施します。
映画『HOME 愛しの座敷わらし』に登場する座敷わらしとは、どのような存在ですか？,座敷わらしは、岩手県を中心に現れるといわれる精霊のような存在で、座敷わらしがいる家は栄え、去った家は衰退すると言われています。
映画『HOME 愛しの座敷わらし』は、どのような家族の物語ですか？,本作は、座敷わらしがある家族の再生のきっかけになる物語です。
映画『HOME 愛しの座敷わらし』で水谷豊は、過去にどのような映画で主演を務めていましたか？,水谷豊は『逃れの街』以来28年ぶりに単独主演を果たします。
映画『HOME 愛しの座敷わらし』には、水谷豊の他に誰が出演していますか？,安田成美、濱田龍臣、橋本愛、草笛光子らが出演しています。
座敷わらしが家にいると、なぜ家は栄えると言われるのですか？,テキストからは直接的な理由は述べられていませんが、座敷わらしは家の繁栄をもたらすと考えられているためです。
この物語の監督は誰ですか？,和泉聖治が監督を務めています。
高橋一家が引っ越した古民家は何年前に建てられましたか？,高橋一家が引っ越した古民家は築200年です。
高橋一家が岩手県の片田舎に引っ越した理由は何ですか？,晃一の転勤が理由で、高橋一家は岩手県の片田舎へ引っ越すことになりました。
座敷わらしは、高橋一家にどのような影響を与えますか？,座敷わらしをきっかけに、高橋一家はそれぞれが自身を見つめ直し、家族の絆を再生していきます。
物語の中で、高橋一家の各メンバーはどのような問題を抱えていますか？,晃一は家でも会社でも居場所がなく、史子は夫の脳天気さに不満を持ち、梓美は友人関係に悩み、智也は喘息のため過保護に扱われ、澄子は認知症の症状が出始めています。
『普通のサラリーマンを演じたい』の原作は？,荻原浩の同名小説で、朝日新聞夕刊に連載された。
映画化のきっかけは？,水谷豊がホームドラマ製作を願ったことと、今まで演じたことのない“普通のサラリーマン”を演じたいという願望から。
水谷豊が演じる晃一は、どのように通勤しているか？,家から最寄りの駅まで自転車で30分かけて通勤している。
安田顕が演じる史子の人物像は？,都会暮らしに慣れており、田舎特有のご近所付き合いが苦手である。
『普通のサラリーマンを演じたい』の原作は、直木三十五賞を受賞したか？,候補には選出されたが、受賞はしていない。
史子の家の隣家との距離はどのくらいですか？,史子の家の隣家は遠く、引っ越しの挨拶をするのも一苦労なほどです。
バラバラになった家族の再生に必要なものは何だと監督は言っていますか？,監督は、バラバラになった家族の再生には第三者の介入が必要だと言っています。
本作で家族の絆を結ぶ役割を果たすものは何ですか？,本作では、座敷わらしと古民家にある囲炉裏が家族の絆を結ぶ役割を果たします。
現代において、囲炉裏は都会に住む家族にとって何に置き換えられるでしょうか？,都会に住む家族にとっては、囲炉裏は食卓を囲むことに置き換えられるでしょう。
家族の絆を深める方法として、食卓を囲むこと以外にどのような方法が考えられますか？,家族で食卓を囲んで喧嘩になることも、絆を深める方法の一つになるかもしれません。
映画『HOME 愛しの座敷わらし』のロケ地はどこですか？,ロケ地は岩手県遠野、岩手山、盛岡、滝沢村、雫石町、花巻です。
水谷豊が29連泊も帰京しなかった理由は何ですか？,水谷豊は岩手県の自然に惚れ込んだため、29連泊し一度も帰京しなかった。
映画の公開に合わせて原作者は何を製作しましたか？,映画の公開に合わせ、原作者の荻原は、新たに創案した絵本「ここにいるよ ざしきわらし」を製作しました。
『HOME 愛しの座敷わらし』の楽しみ方はいくつありますか？,小説、映画、絵本という3つの楽しみ方があります。
映画に盛り込まれた草木の姿や音は、何を強調するために使われていますか？,座敷わらしの存在を強調するために使われており、岩手県の持つ美しい自然を感じさせます。
映画『HOME 愛しの座敷わらし』のマサキによるほのぼの度は何ですか？,マサキによるほのぼの度は★★★★です。
映画『HOME 愛しの座敷わらし』の魅力度が高い都道府県はどこですか？,岩手県の魅力度が高いと評価されています。
水谷豊は映画でどのような役を演じていますか？,水谷豊はサラリーマン役を演じています。
ジェームズ・キャメロンが来日するのは、どの映画のためですか？,『タイタニック3D』の成功を期して来日します。
映画『FAIRY TAIL』に登場する物語の鍵となる少女の名前は何ですか？,物語の鍵となる少女の名前はエクレアです。
ゲームブックとはどのようなものですか？,選択肢によって物語が変化する、ゲームのように読み進める本のことです。
WEB版ゲームブック『ベルセルク 黄金時代篇II ドルドレイ攻略』では、誰になりきってプレイしますか？,鷹の団のガッツになりきってプレイします。
WEB版ゲームブック『ベルセルク 黄金時代篇II ドルドレイ攻略』をクリアすると、どのようなチャンスがありますか？,ベルセルクファンには垂涎の褒賞が与えられるチャンスがあります。
WEB版ゲームブックで物語を読み進める際、どのように選択肢を選びますか？,場面で正しい判断だと思う選択肢をクリックします。
なぜ80年代にゲームブックが流行したのですか？,テキストに情報がないため、理由は不明です。
ゲームブックでBAD ENDを迎える原因は何ですか？,間違った選択をしてしまうとBAD ENDになります。
HAPPY ENDに辿りつくと何が得られますか？,HAPPY ENDに辿り着くと“褒賞”に応募できる秘密のキーワードを確認できます。
ゲームを進めずにキーワードを確認する方法はありますか？,全ページを見ればキーワードはわかりますが、推奨されていません。
褒賞は何ですか？,映画『ベルセルク』iPhoneケースが褒賞です。
ゲーム開始時に選択できる行動は何ですか？,ドルドレイの攻略を始めるか、ベルセルク特集で魅力を確認するかを選択できます。
映画化される「ポチたま」の人気コーナーのタイトルは何ですか？,「まさお君が行く！ポチたまペットの旅」が映画化されます。
映画「ポチたま」で主演を務めるのは誰ですか？,SMAPの香取慎吾が主演を務めます。
映画「ポチたま」でヒロインを演じるのは誰ですか？,広末涼子がヒロインを演じます。
なぜ、まさおが「ポチたま」の旅コーナーの犬に選ばれたのですか？,ギャラが安かったからです。芸もなく、ただひたすらに食いしん坊だったことも理由の一つです。
映画「ポチたま」で、松本秀樹を演じるのは誰ですか？,香取慎吾が松本秀樹を演じます。
松本がまさおとコンビを結成するきっかけは何でしたか？,ロケ中に怪我をした松本を、まさおが真っ先に助けに走ったことがきっかけで、二人は一心同体になることを決意しました。
松本は番組が始まる前、まさおに対してどのような感情を抱いていましたか？,犬が主体の番組と知り、落胆し、まさおに振り回され、何をしても空回りしていました。
松本とまさおは最終的にどうなりましたか？,まさおの体調が悪化し、命に関わる持病を持っていることが発覚したため、松本はまさおが幸せな一生を送れるようにダイアンと過ごさせることを願いました。
松本がまさおと出会う前に失ったものは何ですか？,お笑いコンビの相方と、同棲していた彼女の須永里美（広末）を失いました。
松本がまさおのために願ったことは何ですか？,かつてロケ先で相思相愛になった犬のダイアンと幸せな一生を送って欲しいと願いました。
「まさお君が行く！ポチたまペットの旅」は、何の番組のコーナーが基になっているか？,「ペット大集合！ポチたま」という番組の中で、特に人気のあったコーナーが基になっている。
「まさお君が行く！ポチたまペットの旅」では、誰と誰が全国行脚したか？,オスのラブラドールレトリバーのまさおと、若手芸人の松本が全国行脚した。
「まさお君が行く！ポチたまペットの旅」が人気を博した理由は何か？,ちょっと天然でおバカなまさおと、それに振り回される松本とのユーモラスなやりとりが、大きな話題を呼んだため。
本作の主人公であるまさお君の犬種は何ですか？,まさお君はオスのラブラドールレトリバーです。
もし「まさお君が行く！ポチたまペットの旅」のような企画を現代のSNSで行うとしたら、どのような工夫が必要だと思いますか？,SNSでの拡散を意識し、視聴者参加型の企画を取り入れたり、短い動画を継続的に配信するなど、プラットフォームに合わせた工夫が必要でしょう。
本作で主人公・松本を演じるのは誰ですか？,香取慎吾が主人公・松本を演じます。
松本の彼女役、須永を演じるのは誰ですか？,広末涼子が須永を演じます。
本作の監督は誰ですか？,大谷健太郎が監督を務めています。
広末涼子が出演してきた話題作の例を２つあげてください。,広末涼子は『おくりびと』や『GOEMON』などの話題作に出演してきました。
香取慎吾はこれまでどのような作品に主演してきましたか？,香取慎吾は『NIN×NIN 忍者ハットリ君 THE MOVIE』や『西遊記』などに主演してきました。
映画『ジョン・カーター』の原作となった小説のタイトルは何ですか？,原作はエドガー・ライス・バローズの小説『火星のプリンセス』です。
映画『ジョン・カーター』は、いつ公開されましたか？,2012年4月13日に2D・3Dで同時公開されました。
『スター・ウォーズ』や『アバター』などの大作映画に影響を与えたと言われる小説は何ですか？,エドガー・ライス・バローズの『火星のプリンセス』が影響を与えたと言われています。
映画『ジョン・カーター』の舞台となる惑星の名前は何ですか？,映画の舞台となる惑星の名前は“バルスーム”です。
映画『ジョン・カーター』の絵画コンクールの授賞式はどこで行われましたか？,朝日新聞・読者ホールにて行われました。
コンテストで特別審査員を務めた工藤静香は、どのような肩書きのアーティストとして知られていますか？,工藤静香は、画家としても活躍するアーティストとして広く知られています。
工藤静香が選考の苦労を語った理由は？,応募作品が多く、力強い作品が多かったため、選ぶのが難しかったと述べています。
工藤静香は授賞式で受賞者にどのような言葉をかけましたか？,工藤静香は受賞者に「とっても力強くて素敵な絵でした。どうもありがとう！」と祝福の言葉をかけました。
工藤静香は授賞式でどのような役割を果たしましたか？,工藤静香は、特別審査員として各賞の選考に加わり、プレゼンターとして受賞者への贈呈を行いました。
工藤静香がプレゼンターとして登壇した際、会場の反応は？,工藤静香が登壇した際には、客席から大きな拍手が送られました。
特別審査員賞に輝いたのは何歳の女の子ですか？,3才の女の子が特別審査員賞に輝きました。
工藤が最優秀賞を選んだ理由は何ですか？,絵が力強く、映画に出てくる“バルスーム”のイメージがあり、素晴らしい創造力と色使いだったからです。
工藤が絵を描く際にイメージした原作は何ですか？,工藤は『ジョン・カーター』の原作である『火星のプリンセス』をイメージして絵を描きました。
映画『ジョン・カーター』はどのような内容ですか？,映画『ジョン・カーター』は、ロマンスとアドベンチャーがあり、勇気をもらえる家族や恋人と楽しめる作品です。
工藤は絵を描く際にどのような素材を使用しましたか？,工藤は絵を描く際に赤い色や砂などの素材を使用しました。
最優秀賞を受賞したのは誰ですか？,有田幸樹さんです。年齢は9歳です。
特別審査員賞を受賞したのは誰ですか？,前田桜姫愛さんです。年齢は3歳です。
朝日新聞賞を受賞した2人は誰ですか？,辻明日香さんと古米遥さんです。それぞれ14歳と18歳です。
ディズニー賞を受賞した木谷家は何人ですか？,3人です。木谷安憲さん(49歳)、木谷隆太さん(8歳)、木谷文香さん(5歳)です。
MOVIE ENTERの特集ページで実施中のキャンペーンの内容は何ですか？,ディズニーの名作ブルーレイ6タイトルが当たるTwitterキャンペーンです。
映画『三銃士／王妃の首飾りとダ・ヴィンチの飛行船』はいつ公開されますか？,2011年10月28日（金）から公開されます。
