question,answer
小説『八日目の蝉』の作者は誰ですか？,直木賞作家の角田光代です。
映画『八日目の蝉』は、小説を原作としていますが、最初に行われた映像化は何ですか？,2010年に檀れいと北乃きいが出演したテレビドラマです。
映画『八日目の蝉』で永作博美と共演した女優は誰ですか？,井上真央です。
『八日目の蝉』という物語は、どのような罪を犯した女性を描いていますか？,妻子ある男性と愛し合い、その子を身ごもったものの、諦めざるを得なかった女性を描いています。
『八日目の蝉』のDVDとブルーレイはいつ発売されましたか？,劇場公開から半年後の2011年10月28日に発売されました。
野々宮希和子が恵理菜を誘拐した理由は？,不倫相手との子供を中絶し、二度と子供を産めない身体になった希和子が、最後に諦めをつけるため恵理菜の顔を見た際、恵理菜が笑顔で彼女に向けたため、思わず誘拐してしまった。
野々宮希和子は、恵理菜を誘拐後、どこで暮らしましたか？,野々宮希和子は恵理菜を誘拐後、逃避行を続け、最終的に小豆島に落ち着き、母と娘として暮らし始めました。
希和子は不倫相手にどのような言葉を信じていましたか？,希和子は不倫相手の「いずれ妻と別れるから、それまで待ってくれ」という常套句を信じていました。
希和子が子供を産めなくなった原因は何ですか？,不倫相手との子供を中絶した後遺症により、希和子は二度と子供を産めない身体となりました。
誘拐された赤ん坊の名前は何ですか？,誘拐された赤ん坊の名前は恵理菜です。
恵理菜が薫と名を変えた後、どこで幸せな時間を過ごしましたか？,人目を避けて各地を転々としながら、恵理菜と薫は幸せな時間を過ごしました。
恵理菜と薫の逃避行は最終的にどこで終わりましたか？,小豆島で4年間の逃避行に終止符を打ちました。
恵理菜は実の両親と再会後、どのような状況に置かれましたか？,世間から言われのない中傷を受け、本当の両親との関係を築けないままでした。
恵理菜が過去と向き合うことになったきっかけは何ですか？,不倫相手の子を宿し、憎み続けてきた希和子と同じ道を歩んでいることに気づいたことです。
恵理菜は誰と逃亡生活を追憶する旅に出ましたか？,小池栄子が演じるルポライター・安藤千草と共に旅に出ました。
恵理菜が小豆島で見た真実とは何ですか？,希和子との幸せだった時間に触れながら、最終地・小豆島に辿り着いた恵理菜が見た真実です。
八日目の蝉というタイトルは、何を象徴していると考えられますか？,通常7日で死ぬ蝉が8日目に生き残ることから、恵理菜と希和子が過ごした特別な時間や、世間一般とは異なる幸せを象徴していると考えられます。
作中で、蝉はどのような生き物として描かれていますか？,蝉は、短い命を生きる儚い存在として描かれており、作中では、恵理菜や希和子の境遇と重ね合わせて、その生き様が表現されています。
希和子と恵理菜にとっての「八日目」は、どのような時間だったと言えるでしょうか？,希和子と恵理菜にとっての「八日目」は、中絶によって子供を産めなくなった希和子と、誘拐された恵理菜にとって、かけがえのない幸せな時間だったと考えられます。
映画『八日目の蝉』の主題歌を歌った中島美嘉は、どのような状況で復帰しましたか？,中島美嘉は、耳管開放症のため音楽活動を休止していましたが、デビュー10年目に突入した2010年10月に復帰第一弾シングルとして主題歌『Dear』をリリースしました。
映画「八日目の蝉」のDVD通常版の発売日はいつですか？,2011年10月28日に発売されました。
映画「八日目の蝉」には、井上真央以外にどのような女優が出演していますか？,永作博美、森口瑤子、小池栄子が出演しています。
この楽曲は誰が提供しましたか？,原作に深い感銘を受けた彼女が提供しました。
映画「八日目の蝉」のDVD通常版は、Amazonでどのくらいの売り上げランキングですか？,Amazon.co.jpで266位です。
井上真央が演じる役柄はどのような状況に置かれていますか？,逃避行をしているようです。
藤原竜也が中学生とロケット打ち上げを行った映画のタイトルは何ですか？,映画『おかえり、はやぶさ』です。
特別授業が行われた中学校の名前は何ですか？,千代田区立神田一橋中学校です。
奥村展三文部科学副大臣は生徒たちにどのようなエールを送りましたか？,大きな夢の実現のために、文部科学省も環境を作り応援しているので、チャレンジ精神で頑張ってほしいとエールを送りました。
藤原竜也が中学生と特別授業を行った目的は何ですか？,映画『おかえり、はやぶさ』と文部科学省とのタイアップとして、“宇宙”をテーマに特別授業を行うためです。
特別授業は何部制で行われましたか？,2部制で行われました。
第1部でロケットの不思議について説明したのは誰ですか？,日本宇宙少年団とJAXA（宇宙航空研究開発機構）が説明しました。
アルコールロケット発射で、実際の燃料の水素の代わりにアルコールが使われた理由は何ですか？,水素は危険を伴うため、安全なアルコールで代用されました。
アルコールロケットは何を模倣して飛ばしましたか？,ロケットと同じ原理で飛ばすことで、理解を深めることを目的としました。
アルコールロケットが命中したくす玉から現れた垂れ幕には何と書かれていましたか？,“祝！ 卒業「おかえり、はやぶさ」大ヒット祈願”と書かれていました。
第2部では、藤原さんは生徒と何を行いましたか？,藤原さんは生徒とともにアルコールロケットを発射させました。
イベントに参加した生徒の人数は何人ですか？,イベントには132名の生徒が参加しました。
藤原さんは中学生に向けてどのようなメッセージを送りましたか？,藤原さんは、卒業を控えた中学生に対して、諦めずに前に進んでほしいとメッセージを送りました。
藤原さんは学校について、どのような感想を持ちましたか？,藤原さんは、学校が寒いと感じ、友達と遊んだことを思い出し興奮したと述べています。
藤原さんはどのような分野に興味がありますか？,藤原さんは宇宙、生物、生命体などに興味があると述べています。
藤原さんがはやぶさに興味を持った理由は何ですか？,藤原さんははやぶさをリアルタイムで見たり調べたりしていたため、興味を持ちました。
はやぶさの宇宙の旅は何年間でしたか？,往復7年間です。
JAXAの人々が諦めずに帰還を成功させた理由は何ですか？,数センチ、数ミリの希望を奇跡的にキャッチしたからです。
映画の中で引用されたウィンストン・チャーチルの言葉は何ですか？,「成功とは意欲を失わずに、失敗に次ぐ失敗を繰りかえすことである。」という言葉です。
JAXAの人々の行動から、中学生は何を学ぶことができますか？,多くの経験をして失敗をしても、意欲を失わないで次に繋げることの大切さを学べます。
はやぶさの旅で移動した距離は何キロメートルですか？,60億キロメートルです。
藤原さんが中学三年生の時の夢は何でしたか？,サッカー選手になることでした。勉強はせず、給食を食べるために学校へ行っていたほど、サッカーに打ち込んでいました。
藤原さんがサッカー選手から演劇の世界へ入るきっかけは何でしたか？,演劇の世界に入ることになり、気が付いたら演劇の世界に引っ張られていたと述べています。具体的なきっかけは明言されていません。
藤原さんが重要だと考えていることは何ですか？,多くの人と出会い、恋愛をし、楽に楽しく過ごすことが重要だと考えています。
藤原さんが日本の宇宙開発プロジェクト、はやぶさに対して期待することは何ですか？,国民一人一人がはやぶさ2号機を応援することで、活気がでることを期待しています。
日本の開発技術はアジアでどのような状況ですか？,アジアで1位でなくてはいけないという大変な状況です。
映画『おかえり、はやぶさ』の公開日はいつですか？,2012年3月10日(土)に3D&2D同時公開されました。
映画『おかえり、はやぶさ』はどのような内容ですか？,JAXAの協力のもと、小惑星探査機“はやぶさ”が地球に帰還するまでのエピソードを3D映画化したものです。
映画『おかえり、はやぶさ』には誰が出演していますか？,藤原竜也、杏、三浦友和、まえだまえだの前田旺志郎などが出演しています。
藤原竜也は映画を通して、観客にどのような気持ちになってほしいと考えていますか？,宇宙への興味を持ってもらい、夢へ向かって進むための光を射してくれるような映画になってほしいと考えています。
映画のテーマの一つは何ですか？,映画のテーマの一つは、家族や仲間の絆です。
映画『おかえり、はやぶさ』に出演している日本人俳優は誰ですか？,藤原竜也と杏が出演しています。
「はやぶさ」をテーマにしたグルメにはどのようなものがありますか？,うな重、カレー、ケーキなどがあります。
なぜ藤原竜也や杏といった日本の俳優では宇宙に行けないと記事で述べられているのですか？,記事は、俳優のスケール（人気、影響力など）と宇宙に行くことの直接的な関係性について述べているのではなく、映画のテーマや内容に関連して言及していると考えられます。
映画『おかえり、はやぶさ』を見て、宇宙探査のどのような側面に興味を持ちましたか？具体的な例を挙げて説明してください。,（例）宇宙探査機の困難なミッションと、それを支える人々の努力に興味を持ちました。例えば、はやぶさの帰還までの様々なトラブルを乗り越える技術力やチームワークに感銘を受けました。
映画『戦火の馬』のロイヤル・プレミアには誰が出席しましたか？,ウィリアム王子とキャサリン妃が出席しました。
『戦火の馬』のロイヤル・プレミアは、どのような目的で開催されましたか？,英国王室ウィリアム王子とハリー王子が運営する慈善団体のチャリティイベントとして開催されました。
ウィリアム王子とキャサリン妃にとって、この映画プレミアへの出席はどのような意味がありましたか？,結婚後、初の映画プレミア公式出席となりました。
『戦火の馬』は、いつから日本で全国ロードショーされますか？,3月2日から全国ロードショーとなります。
映画『戦火の馬』は当時、どのような評価を受けていましたか？,アカデミー賞最有力候補として大きな注目を集めていました。
『戦火の馬』の舞台となっている戦争は何ですか？,第一次世界大戦です。
『戦火の馬』の原作小説を書いたのは誰ですか？,マイケル・モーパーゴです。
舞台劇『戦火の馬』はいつ、どこで初演されましたか？,2007年にロンドンのロイヤル・シアターで初演されました。
エリザベス女王はなぜ舞台劇『戦火の馬』を観劇したのですか？,「希望」と「絆」をテーマにした感動的な物語が評判を博し、女王も興味を持ったためです。
映画『戦火の馬』の監督は誰ですか？,スティーブン・スピルバーグ監督です。
レッドカーペットに登場した監督は誰ですか？,スピルバーグ監督がレッドカーペットに登場しました。
キャサリン妃は何歳の誕生日を迎えるのですか？,キャサリン妃は30歳の誕生日を迎えます。
ウィリアム王子はキャサリン妃に何をしましたか？,ウィリアム王子はキャサリン妃に傘をさしかけました。
キャサリン妃が着用していたドレスのブランドは？,キャサリン妃はアリス・バイ・テンパリーのドレスを着用していました。
レッドカーペットに登場した俳優を2人挙げてください。,ジェレミー・アーヴァインとトム・ヒドルストンがレッドカーペットに登場しました。
スピルバーグ監督らが言葉を交わしていた会場の名前と収容人数は何ですか？,会場はオデオン劇場で、1600名を収容できます。
「希望」と「絆」の物語は、誰から誰に受け継がれた形になりましたか？,エリザベス女王からウィリアム王子とキャサリン妃に受け継がれました。
スピルバーグ監督にとって、今回のロイヤル・プレミアはどのような経験でしたか？,スピルバーグ監督にとって久々のロイヤル・プレミアであり、「とても名誉なことだ」と語っています。
「希望」と「絆」の物語は、30年の間にどのように変化してきましたか？,文学、演劇、映画と時と共に形を変え、人々に愛されてきました。
ウィリアム王子とキャサリン妃は、イギリス王室においてどのような象徴と言われていますか？,新しいイギリス王室の象徴と言われています。
スティーブン・スピルバーグが過去にロイヤル・プレミアで迎えた人物は誰ですか？,エリザベス女王とチャールズ皇太子、故・ダイアナ妃夫妻を迎えた経験があります。
スピルバーグ監督がケンブリッジ公爵夫妻に会うのは今回が初めてですか？,はい、ケンブリッジ公爵夫妻に会うのは今回が初めてだと述べています。
スピルバーグ監督の映画で、今回はどのようなテーマを中心に描かれていますか？,今回の映画は“絆”というテーマを中心に、動物が人々を結びつけ、人間の善の部分を引き出す存在になり得ることを描いています。
スピルバーグ監督が過去に手掛けた『プライベート・ライアン』や「バンド・オブ・ブラザーズ」と比較して、今回の映画はどのような点が異なりますか？,今回の映画は戦争モノではなく、叙情的なテーマを描いている点が異なります。
今回の映画で、動物はどのような役割を果たしていますか？,動物は人々を結びつけ、人間の善の部分を引き出す存在として描かれています。
キャスリーン・ケネディは、チャールズ皇太子とダイアナ妃を過去にどのように迎えた経験がありますか？,スティーヴンと一緒にロイヤル・プレミアで何度か迎えた経験があります。
キャスリーン・ケネディにとって、この映画が特別な体験になった理由は何ですか？,たくさんの美しい馬たちに囲まれた撮影を含め、作品に携わったすべての人にとって思い出深い体験になったためです。
この映画が日本の観客にとって意味深いテーマとは何ですか？,人間と動物の間に生まれる“絆”と“希望”です。
ジェレミー・アーヴァインは何に光栄だと感じていますか？,自分の姿を王室の方たちにスクリーンで観てもらえることに光栄を感じています。
この映画の製作において、特に思い出深い要素は何だと考えられますか？,たくさんの美しい馬たちに囲まれた撮影経験が、特に思い出深い要素だと考えられます。
トム・ヒドルストンはこの映画に参加できたことをどう思っていますか？,彼はこの映画に参加できたことと、ロイヤル・プレミアに来られたことを非常に嬉しく思っています。
この映画はどのようなメッセージを持っていますか？,この映画は人に優しくあれ、という素晴らしいメッセージを持っています。
ケンブリッジ公爵夫妻はこの映画をどのように思っていますか？,ケンブリッジ公爵夫妻はこの映画を気に入って応援してくれています。
映画の中でジョーイはどのような存在ですか？,ジョーイは残酷な戦争に巻き込まれながらも果敢に行きぬく奇跡の馬であり、出会った人々に勇気と優しさを運びます。
トム・ヒドルストンが一番好きなシーンを選べない理由は何ですか？,どのシーンをとっても素晴らしいからです。
『戦火の馬』の主人公である馬の名前は何ですか？,ジョーイという名前です。
ジョーイは誰と深い絆で結ばれていましたか？,農家の息子アルバートと深い絆で結ばれていました。
ジョーイはなぜアルバートから引き離されたのですか？,第一次世界大戦の開戦によって、ジョーイは英国軍の軍馬として最前線に送られたためです。
『戦火の馬』の物語は、ジョーイにとってどのような始まりでしたか？,ジョーイの驚くべき旅の始まりであり、戦時下の人間たちの切なくも美しいドラマの始まりでした。
『戦火の馬』の舞台設定は、どのような時代と場所ですか？,第一次世界大戦前夜のイギリスの農村が舞台です。
香里奈が出席した映画のタイトルは何ですか？,映画『ガール』です。
試写会は誰を対象に行われましたか？,女子高生限定で行われました。
試写会には何人くらいの女子高生が参加しましたか？,約100人の女子高生が参加しました。
香里奈はどのように登場しましたか？,会場後方の扉からサプライズで登場しました。
香里奈の登場に対して、女子高生たちはどのような反応をしましたか？,「キャー！」「カワイイ！」「ヤバイ！」と悲鳴に近い歓声が上がりました。
香里奈の女子高生時代のファッションは何風でしたか？,香里奈の女子高生時代はアムラーファッションでした。
香里奈が女子高生時代に好きだった歌手は誰ですか？,香里奈は女子高生時代に安室奈美恵さんが好きでした。
香里奈は、なぜ今の女子高生事情に興味津々な様子だったのですか？,香里奈は、自身の女子高生時代との違いを感じ、今の女子高生事情に興味を持ったようです。
香里奈は、綺麗を保つためにどのような努力をしていますか？,香里奈は、見られる職業であるため、綺麗でいるために努力していると述べています。
香里奈は中高生の頃、肌に対してどのようなケアをしていましたか？,香里奈は中高生の頃、メイクをしたまま寝てしまうことがありましたが、肌が若かったため問題ありませんでした。
美の秘訣として伝えられたものは何ですか？,水やお茶を飲むこと、マッサージに行くこと、お風呂上りにストレッチをすることなどが美の秘訣として伝えられました。
なぜ夜の炭水化物を控えるのですか？,炭水化物が好きで人並みに太るため、夜の炭水化物を控えることで体重管理をしているようです。
炭水化物とお酒は、なぜ控えるべきなのですか？,炭水化物とお酒は太りやすい組み合わせだからです。
10代のうちに経験することは、将来にどう役立ちますか？,10代に経験したことは、今に生きることがたくさんあるため、将来に役立つと述べられています。
もし挑戦してダメだと思ったらどうすればいいですか？,ダメだと思ったら、また次の道を選べば良いと述べられています。
映画『ガール』はいつから全国ロードショーですか？,5月26日（土）から全国ロードショーです。
映画『ガール』公式サイトはどこにありますか？,関連リンクに映画『ガール』公式サイトへのリンクがあります。
映画『ガール』に関するアドバイスは何ですか？,どんどん新しいことや夢を追いかけて欲しいというアドバイスが送られています。
映画『ガール』の関連情報を得るにはどこを参照すればいいですか？,映画『ガール』公式サイトや映画『ガール』特集を参照してください。
映画『キャプテン・アメリカ/ザ・ファースト・アベンジャー』の公開記念イベントはどこで開催されましたか？,東京・千代田区の内幸町ホールで開催されました。
ユージは、イベントでどのような役割を果たしていましたか？,ユージは和製キャプテン・アメリカとして、バイクに乗って登場し、キャプアメ・ガールズを引き連れてイベントを盛り上げる役割でした。
なぜJOYはユージの前に立ちはだかったのですか？,JOYは「僕はAKBの高橋みなみを守る」と言ってユージの前に立ちはだかりました。詳細は不明ですが、高橋みなみを守るという目的があったようです。
上島竜兵は、イベント前にどのような企画に参加しましたか？,上島竜兵は“スーパーソルジャー計画”イベントに参加し、和製キャプテン・アメリカのユージとして生まれ変わりました。
イベントに登場したユージは、以前と比べてどのような変化がありましたか？,ユージは、上島竜兵から極秘実験によってイケメンマッチョに変身し、以前とは異なる姿でイベントに登場しました。
イベント当日、キャプテン・アメリカのPRイベントに現れたのは誰でしたか？,レッド・スカルが現れました。
レッド・スカルの正体は誰でしたか？,レッド・スカルの正体はモデルのJOYでした。
ユージとJOYが比較される理由は何ですか？,容姿や芸風の類似から比較されます。
JOYが『ヒルナンデス!』を休養していた際、代役を務めたのは誰ですか？,ユージが代役を務めました。
キャプテン・アメリカとレッド・スカルの関係と異なり、ユージとJOYの関係で特筆すべき点は何ですか？,二人はプライベートでも仲が良いという点です。
ユージがキャプテン・アメリカとしての仕事でバイクに乗った時の気持ちはどうでしたか？,とても気持ちが良く、キャプアメ・ガールズが一緒にいてくれたのでテンションが上がりました。
全国をまわった宣伝活動で、ユージはどのような経験をしましたか？,どこに行っても温かく迎えられ、小さい子どもたちが目をキラキラさせているのを見てヒーローとしての自覚が高まりました。
クリス・エヴァンスからのビデオメッセージを見て、ユージはどう思いましたか？,めちゃくちゃ嬉しいと感じました。本物のキャプテン・アメリカからのメッセージだったからです。
JOYの登場を知らされていなかったユージは、JOYだとどのように気づきましたか？,マスクをしていても、独特の声と骨格と動きですぐにJOYだと解りました。
JOYの登場を知らされていなかったユージは、登場を知らされていた場合と何が違いましたか？,JOYの登場を知らされていなかったため、リハーサルでは完璧だったセリフを飛ばしてしまいました。
ユージとJOYは、お互いの性格についてどのように述べていますか？,ユージは、実際にはJOYとは性格が正反対だと述べています。JOYは、TVでは自身がちゃらいキャラだが、実際にはユージの方がちゃらいと述べています。
ユージにとってJOYはどのような存在ですか？,ユージにとってJOYはライバルというよりは戦友のような存在です。
