question,answer,question_type,source_chunk_id,doc_id,dataset_type,chunk_idx,provider
アンパサンド（&）は何を意味する記号ですか？,アンパサンドは、並立助詞「…と…」を意味する記号です。,fact,wikipedia_ja_0_アンパサンド_chunk_0,wikipedia_ja_0_アンパサンド,wikipedia_ja,0,gemini
アンパサンド（&）の起源は何ですか？,"アンパサンドは、ラテン語で「…と…」を表す接続詞 ""et"" の合字を起源としています。",fact,wikipedia_ja_0_アンパサンド_chunk_0,wikipedia_ja_0_アンパサンド,wikipedia_ja,0,gemini
"英語で教育を行う学校でアルファベットを復唱する際、""A""のような文字はどのように唱えられていましたか？","""A per se A""のように、ラテン語の per se（それ自体）を用いて唱えられていました。",fact,wikipedia_ja_0_アンパサンド_chunk_0,wikipedia_ja_0_アンパサンド,wikipedia_ja,0,gemini
"アルファベットの復唱の最後が ""X, Y, Z, and per se and"" という形になった理由は何ですか？","アルファベットの最後に ""&"" を加えることが広く行われ、""&"" が英語で and と読まれるようになったためです。",reason,wikipedia_ja_0_アンパサンド_chunk_0,wikipedia_ja_0_アンパサンド,wikipedia_ja,0,gemini
アンパサンドという言葉はいつ頃から英語の一般的な語法となったか？,アンパサンドという言葉は1837年までには英語の一般的な語法となった。,fact,wikipedia_ja_0_アンパサンド_chunk_1,wikipedia_ja_0_アンパサンド,wikipedia_ja,1,gemini
アンパサンドの語源俗説として、アンペールの著作との関連が挙げられているが、これはなぜ誤りなのか？,アンパサンドの起源は1世紀の古ローマ筆記体に遡ることができ、アンペールの著作が広まる以前から存在していたからである。,reason,wikipedia_ja_0_アンパサンド_chunk_1,wikipedia_ja_0_アンパサンド,wikipedia_ja,1,gemini
古ローマ筆記体におけるEとTの合字は、その後の新ローマ筆記体と比べてどのように変化したか？,古ローマ筆記体から新ローマ筆記体にかけて、EとTの合字はより流麗になり、様々な合字が極めて頻繁に使われるようになった。,comparison,wikipedia_ja_0_アンパサンド_chunk_1,wikipedia_ja_0_アンパサンド,wikipedia_ja,1,gemini
カロリング小文字体において、一般的な合字の使用が廃れた一方で、etの合字が使われ続けたのはなぜと考えられるか？,テキストには直接的な理由は記載されていませんが、etの合字が利便性や装飾性において他の合字よりも優れていたため、継続して使用された可能性が考えられる。,application,wikipedia_ja_0_アンパサンド_chunk_1,wikipedia_ja_0_アンパサンド,wikipedia_ja,1,gemini
現代のイタリック体のアンパサンドは、何にさかのぼりますか？,現代のイタリック体のアンパサンドは、ルネサンス期に発展した筆記体での et の合字にさかのぼります。,fact,wikipedia_ja_0_アンパサンド_chunk_2,wikipedia_ja_0_アンパサンド,wikipedia_ja,2,gemini
印刷技術の発明以降、印刷業者はアンパサンドをどのように使用しましたか？,印刷業者はイタリック体とローマ筆記体のアンパサンドの両方を多用するようになりました。,fact,wikipedia_ja_0_アンパサンド_chunk_2,wikipedia_ja_0_アンパサンド,wikipedia_ja,2,gemini
なぜアンパサンドは多くの言語で使用されるようになったのですか？,アンパサンドのルーツはローマ時代にさかのぼるため、ラテンアルファベットを使用する多くの言語で使用されるようになりました。,reason,wikipedia_ja_0_アンパサンド_chunk_2,wikipedia_ja_0_アンパサンド,wikipedia_ja,2,gemini
Byrhtferthの文字表において、アンパサンドはどのような位置づけでしたか？,1011年のByrhtferthの文字表では、アンパサンドはラテンアルファベットの最後の文字とされることがありました。,fact,wikipedia_ja_0_アンパサンド_chunk_2,wikipedia_ja_0_アンパサンド,wikipedia_ja,2,gemini
童謡 Apple Pie ABC はどのような歌詞で締めくくられるか？,"""X, Y, Z, and ampersand, All wished for a piece in hand""という歌詞で締めくくられる。",fact,wikipedia_ja_0_アンパサンド_chunk_3,wikipedia_ja_0_アンパサンド,wikipedia_ja,3,gemini
アンパサンドとティロ式記号の et は意味が同じだが、どのような違いがあるか？,アンパサンドはティロ式記号の et と意味は同じだが、ティロ式記号の et は数字の「7」に似た形をしている。,comparison,wikipedia_ja_0_アンパサンド_chunk_3,wikipedia_ja_0_アンパサンド,wikipedia_ja,3,gemini
アンパサンドとティロ式記号の et は、それぞれどのように発明されたか？,アンパサンドとティロ式記号の et は、それぞれ独立に発明された。,fact,wikipedia_ja_0_アンパサンド_chunk_3,wikipedia_ja_0_アンパサンド,wikipedia_ja,3,gemini
古アイルランド語の文字では、ティロ式記号の et は何を表すために使用されていたか？,古アイルランド語の文字では、アイルランド語の agus（「…と…」）を表すためにティロ式記号の et が使用されていた。,fact,wikipedia_ja_0_アンパサンド_chunk_3,wikipedia_ja_0_アンパサンド,wikipedia_ja,3,gemini
アンパサンドがアイルランドで書き文字に加わった時期はいつ頃ですか？,アイルランドにおけるキリスト教時代初期、修道院の影響によって書き文字に加えられた可能性があります。,fact,wikipedia_ja_0_アンパサンド_chunk_4,wikipedia_ja_0_アンパサンド,wikipedia_ja,4,gemini
日常的な手書きにおいて、アンパサンドはどのような形で簡略化されることが多いですか？,"小文字のエプシロンを大きくしたもの（あるいは数字の ""3"" の鏡文字）に縦線を加えた形が一般的です。",fact,wikipedia_ja_0_アンパサンド_chunk_4,wikipedia_ja_0_アンパサンド,wikipedia_ja,4,gemini
アンパサンドの代わりに使用される記号として、プラス記号（+）と、もう一つ挙げられている記号は何ですか？,プラス記号に輪を重ねたような、無声歯茎側面摩擦音を示す発音記号（のような記号）が使われることがあります。,fact,wikipedia_ja_0_アンパサンド_chunk_4,wikipedia_ja_0_アンパサンド,wikipedia_ja,4,gemini
ティロの速記における「et」を表す記号は、現代の文字コードでどのように表現されますか？,「」(U+204A Tironian sign et)として表現されます。,fact,wikipedia_ja_0_アンパサンド_chunk_4,wikipedia_ja_0_アンパサンド,wikipedia_ja,4,gemini
C言語において、A && B はどのような演算を表しますか？,A && B は論理 AND 演算を表し、AとBがともに真の場合に真、それ以外は偽となります。,fact,wikipedia_ja_0_アンパサンド_chunk_5,wikipedia_ja_0_アンパサンド,wikipedia_ja,5,gemini
C言語における `&` 演算子と `&&` 演算子の違いは何ですか？,`&` はビット AND 演算子であり、`&&` は論理 AND 演算子です。,comparison,wikipedia_ja_0_アンパサンド_chunk_5,wikipedia_ja_0_アンパサンド,wikipedia_ja,5,gemini
PHPで参照渡しを行うにはどうすれば良いですか？,変数宣言記号($)の直前に&を記述することで、参照渡しを行うことができます。,fact,wikipedia_ja_0_アンパサンド_chunk_5,wikipedia_ja_0_アンパサンド,wikipedia_ja,5,gemini
BASIC言語で、'hello'と'world'を連結するにはどうすればよいですか？,'hello' & 'world' のように、&演算子を使用します。結果は 'helloworld' になります。,application,wikipedia_ja_0_アンパサンド_chunk_5,wikipedia_ja_0_アンパサンド,wikipedia_ja,5,gemini
言語の狭義の定義は何ですか？,言語は、狭義には「声による記号の体系」を指します。,fact,wikipedia_ja_1_言語_chunk_0,wikipedia_ja_1_言語,wikipedia_ja,0,gemini
広辞苑における言語の定義を説明してください。,広辞苑では、言語を「人間が音声や文字を用いて思想・感情・意志等々を伝達するために用いる記号体系」と解説しています。,fact,wikipedia_ja_1_言語_chunk_0,wikipedia_ja_1_言語,wikipedia_ja,0,gemini
大辞泉における言語の定義を説明してください。,大辞泉では、言語を「音声や文字によって、人の意志・思想・感情などの情報を表現したり伝達する、あるいは他者のそれを受け入れ、理解するための約束・規則」と解説しています。,fact,wikipedia_ja_1_言語_chunk_0,wikipedia_ja_1_言語,wikipedia_ja,0,gemini
ソシュールの言う「langue」とは、日本語で何と呼ばれていますか？,ソシュールの言う「langue」は、日本語では「言語」と訳されます。,fact,wikipedia_ja_1_言語_chunk_0,wikipedia_ja_1_言語,wikipedia_ja,0,gemini
『日本大百科全書』における「言語」の定義はどのようなものですか？,大脳に蓄えられた語彙と文法規則の体系、その体系を用いる能力、すべての人間が共有する言語能力、個々の個別言語など、多義的に解説されています。,fact,wikipedia_ja_1_言語_chunk_1,wikipedia_ja_1_言語,wikipedia_ja,1,gemini
広義の言語にはどのようなものが含まれますか？,verbal（言葉に表す）なものとnon-verbal（言葉として表されない）もの（各種記号、アイコン、図形、ボディーランゲージ等）の両方が含まれます。,fact,wikipedia_ja_1_言語_chunk_1,wikipedia_ja_1_言語,wikipedia_ja,1,gemini
言語が人間の社会的活動や文化的活動を支えている理由は何ですか？,言語は意志を相互に伝達することや、抽象的な思考を可能にするため、結果として人間の社会的活動や文化的活動を支えています。,reason,wikipedia_ja_1_言語_chunk_1,wikipedia_ja_1_言語,wikipedia_ja,1,gemini
日常のコミュニケーションにおいて、狭義の言語表現以外に用いられるものは何ですか？,身振り、手振り、図示、擬音などが狭義の言語表現に加えて用いられることがあります。,fact,wikipedia_ja_1_言語_chunk_1,wikipedia_ja_1_言語,wikipedia_ja,1,gemini
ソシュール以降、「共同体の用いる言語体系」は何と呼ばれるようになったか？,「langue (ラング)」と呼ばれるようになった。,fact,wikipedia_ja_1_言語_chunk_2,wikipedia_ja_1_言語,wikipedia_ja,2,gemini
言語習得によって、共同体においてどのような学習が行われるか？,言語習得によって、共同体での社会的学習と人格の形成が行われる。,reason,wikipedia_ja_1_言語_chunk_2,wikipedia_ja_1_言語,wikipedia_ja,2,gemini
「langue」と「parole」の違いは何か？,「langue」は共同体の用いる言語体系を指し、「parole」は個々の人が行う言語活動を指す。,comparison,wikipedia_ja_1_言語_chunk_2,wikipedia_ja_1_言語,wikipedia_ja,2,gemini
抽象記号にはどのような種類があるか？,抽象記号には文字表現と非文字表現（積分記号やト音記号など）がある。,fact,wikipedia_ja_1_言語_chunk_2,wikipedia_ja_1_言語,wikipedia_ja,2,gemini
言語表現と区別される文字記号の例として、何が挙げられますか？,化学式H2Oなどが挙げられます。,fact,wikipedia_ja_1_言語_chunk_3,wikipedia_ja_1_言語,wikipedia_ja,3,gemini
口語、口頭言語、書記言語、文語といった言語の分類は、明確に区別できるものですか？,重なる部分もあり、はっきり分類できるものではありません。,fact,wikipedia_ja_1_言語_chunk_3,wikipedia_ja_1_言語,wikipedia_ja,3,gemini
日本語対応手話と日本手話の違いは何ですか？,日本語対応手話は日本語の視覚言語バージョンですが、日本手話は日本語とは異なる言語です。,comparison,wikipedia_ja_1_言語_chunk_3,wikipedia_ja_1_言語,wikipedia_ja,3,gemini
言語的表現は読み上げや点字化によって、それぞれどのような表現に変換されますか？,言語的表現は読み上げによって音声表現に、点字化によって触覚表現に変換されます。,fact,wikipedia_ja_1_言語_chunk_3,wikipedia_ja_1_言語,wikipedia_ja,3,gemini
人工言語の例として、テキスト中で挙げられているものは何ですか？,エスペラントが人工言語の例として挙げられています。,fact,wikipedia_ja_1_言語_chunk_4,wikipedia_ja_1_言語,wikipedia_ja,4,gemini
ジャック・デリダは何を批判しましたか？,ジャック・デリダは、「声」を基礎とし文字をその代替とする発想が言語学に存在することに対する批判をしました。,fact,wikipedia_ja_1_言語_chunk_4,wikipedia_ja_1_言語,wikipedia_ja,4,gemini
ヘブライ語はどのようにして復活したのですか？,ヘブライ語は文章語として存続していたものを、パレスチナに移住したユダヤ人たちが日常語として人工的に復活させました。,reason,wikipedia_ja_1_言語_chunk_4,wikipedia_ja_1_言語,wikipedia_ja,4,gemini
自然言語と人工言語の違いは何ですか？,自然言語は自然発生的に生まれた言語であり、人工言語はエスペラントのように意図的に作られた言語です。,comparison,wikipedia_ja_1_言語_chunk_4,wikipedia_ja_1_言語,wikipedia_ja,4,gemini
文章語として存続している言語の例を3つ挙げてください。,古典アラビア語、ラテン語、古典ギリシア語が文章語として存続している言語の例です。,fact,wikipedia_ja_1_言語_chunk_5,wikipedia_ja_1_言語,wikipedia_ja,5,gemini
危機言語とはどのような言語のことですか？,危機言語とは、話者数が非常に少なく、他言語に飲み込まれて消滅する危機に瀕している言語のことです。,definition,wikipedia_ja_1_言語_chunk_5,wikipedia_ja_1_言語,wikipedia_ja,5,gemini
危機言語が増加する理由は何ですか？,世界の一体化が進み、交通網やマスメディアの発達によって、孤立していた小さな言語コミュニティが維持できなくなるためと考えられています。,reason,wikipedia_ja_1_言語_chunk_5,wikipedia_ja_1_言語,wikipedia_ja,5,gemini
英語帝国主義とはどのような現象を指しますか？,英語帝国主義とは、英語の国際語としての勢力伸張によって、他の主要言語の勢力が縮小する現象を指します。,definition,wikipedia_ja_1_言語_chunk_5,wikipedia_ja_1_言語,wikipedia_ja,5,gemini
言語消滅は主にどのような状況で起こりやすいですか？,隣接するより大きな言語集団との交流が不可欠となり、小言語集団が取り込まれることで言語消滅が起こりやすいです。,reason,wikipedia_ja_1_言語_chunk_6,wikipedia_ja_1_言語,wikipedia_ja,6,gemini
経済成長と言語消滅にはどのような関係があると考えられていますか？,研究によると、経済成長と言語消滅の間には有意な相関があると考えられています。,fact,wikipedia_ja_1_言語_chunk_6,wikipedia_ja_1_言語,wikipedia_ja,6,gemini
2010年に言語が消滅した地域はどこですか？,2010年には、インド領のアンダマン諸島において言語が一つ消滅しました。,fact,wikipedia_ja_1_言語_chunk_6,wikipedia_ja_1_言語,wikipedia_ja,6,gemini
プープー説とはどのような説ですか？,プープー説とは、思わず出た声から感情に関する語ができたとする言語起源に関する仮説の一つです。,definition,wikipedia_ja_1_言語_chunk_6,wikipedia_ja_1_言語,wikipedia_ja,6,gemini
"""Bow Bow"" theoryでは、どのような種類の語が生まれたとされていますか？","""Bow Bow"" theory（ワンワン説）では、動物に関する語が、動物の鳴き声から出来たとされています。",fact,wikipedia_ja_1_言語_chunk_7,wikipedia_ja_1_言語,wikipedia_ja,7,gemini
"""Ding-dong"" theory（ドンドン説）は、どのような現象に関連する語の起源を説明するものですか？","""Ding-dong"" theory（ドンドン説）は、音響から自然物に関する語が出来たことを説明するものです。",reason,wikipedia_ja_1_言語_chunk_7,wikipedia_ja_1_言語,wikipedia_ja,7,gemini
"""Yo-he-ho"" theory（エイヤコーラ説）は、他の二つの説と比べて、どのような特徴がありますか？","""Yo-he-ho"" theory（エイヤコーラ説）は、かけ声から行動に関する語が出来たとする点で、動物の鳴き声や自然の音響から語源を説明する他の二つの説とは異なります。",comparison,wikipedia_ja_1_言語_chunk_7,wikipedia_ja_1_言語,wikipedia_ja,7,gemini
"集団行動における「エイヤコーラ」のような、意味のないはやし歌は、""Yo-he-ho"" theory（エイヤコーラ説）をどのように裏付けていますか？","集団行動における意味のないはやし歌が世界各地に残っていることは、""Yo-he-ho"" theory（エイヤコーラ説）が提唱する、かけ声から行動に関する語が生まれたという考えを支持する根拠となります。",reason,wikipedia_ja_1_言語_chunk_7,wikipedia_ja_1_言語,wikipedia_ja,7,gemini
言語能力の獲得につながった可能性がある遺伝子は何ですか？,FOXP2という遺伝子のある種の変異が、言語能力の獲得につながった可能性があります。,fact,wikipedia_ja_1_言語_chunk_8,wikipedia_ja_1_言語,wikipedia_ja,8,gemini
FOXP2の変異はいつ頃生じたと考えられていますか？,現生人類とネアンデルタール人が分化する以前の30-40万年前にはすでに生じていたと考えられています。,fact,wikipedia_ja_1_言語_chunk_8,wikipedia_ja_1_言語,wikipedia_ja,8,gemini
FOXP2の変異が言語能力の獲得の必要条件であると証明されていないのはなぜですか？,FOXP2は言語能力を有しない他の動物の多くが持っているからです。,reason,wikipedia_ja_1_言語_chunk_8,wikipedia_ja_1_言語,wikipedia_ja,8,gemini
進化が止まった生物の例として何がありますか？,進化が止まった生物の例として、「生きている化石」と呼ばれるものが存在します。,fact,wikipedia_ja_1_言語_chunk_8,wikipedia_ja_1_言語,wikipedia_ja,8,gemini
言語が大きく変化する要因は何ですか？,言語は、侵略、交易、移動など、他民族との接触が多い場合に大きく変化します。,reason,wikipedia_ja_1_言語_chunk_9,wikipedia_ja_1_言語,wikipedia_ja,9,gemini
語族とは何ですか？,語族とは、もともといくつかの祖語から分化したと考えられており、同一の祖語から発生した言語のグループです。,definition,wikipedia_ja_1_言語_chunk_9,wikipedia_ja_1_言語,wikipedia_ja,9,gemini
言語連合とはどのような現象ですか？,言語連合とは、地理的・文化的に近接する異なった系統の言語が、相互に影響しあい顕著に類似する事例を指します。,definition,wikipedia_ja_1_言語_chunk_9,wikipedia_ja_1_言語,wikipedia_ja,9,gemini
接触が少ないとほとんど変化しなくなる言語の例を３つ挙げてください。,ドイツ語、アイスランド語、ギリシア語などが、接触が少ないためにほとんど変化しない言語の例です。,fact,wikipedia_ja_1_言語_chunk_9,wikipedia_ja_1_言語,wikipedia_ja,9,gemini
言語史を作成する際、どのように時代区分しますか？,言語史は、単語・綴り・発音・文法等から古代・中世・近代と3分割されます。,fact,wikipedia_ja_1_言語_chunk_10,wikipedia_ja_1_言語,wikipedia_ja,10,gemini
言語接触によって何が起こりますか？,言語接触により、両言語間で語彙の借用が発生したり、商業や生活上の必要から混成言語が発生することがあります。,fact,wikipedia_ja_1_言語_chunk_10,wikipedia_ja_1_言語,wikipedia_ja,10,gemini
ピジン言語とクレオール言語の違いは何ですか？,ピジン言語は非常に簡略化された形ですが、クレオール言語は語彙が多く、体系だった文法が存在します。,comparison,wikipedia_ja_1_言語_chunk_10,wikipedia_ja_1_言語,wikipedia_ja,10,gemini
クレオール言語は、どのような言語と見なすことができますか？,クレオール言語は語彙も多く体系だった文法が存在するため、一個の独立した言語と見なすことができます。,application,wikipedia_ja_1_言語_chunk_10,wikipedia_ja_1_言語,wikipedia_ja,10,gemini
クレオール言語とピジン言語の主な違いは何ですか？,クレオール言語は母語話者が存在するのに対し、ピジン言語は母語話者が存在しない点が異なります。,comparison,wikipedia_ja_1_言語_chunk_11,wikipedia_ja_1_言語,wikipedia_ja,11,gemini
中世ヨーロッパにおいて、ラテン語はどのような役割を果たしていましたか？,ラテン語は知識人の間の共通語として用いられ、ルネサンスなどで大きな役割を果たしました。,fact,wikipedia_ja_1_言語_chunk_11,wikipedia_ja_1_言語,wikipedia_ja,11,gemini
標準語の制定は、国民国家の成立にどのように貢献しましたか？,言語の整備と国内共通語の成立は、国民国家を成立させる上での重要な要素となりました。,reason,wikipedia_ja_1_言語_chunk_11,wikipedia_ja_1_言語,wikipedia_ja,11,gemini
印刷術の発展や宗教改革は、ヨーロッパの言語にどのような影響を与えましたか？,印刷術の発展や宗教改革により、各国において日常言語が文語として用いられるようになり、標準語の制定が進みました。,reason,wikipedia_ja_1_言語_chunk_11,wikipedia_ja_1_言語,wikipedia_ja,11,gemini
標準語の制定は、言語にどのような影響を与えるか？,標準語の制定は、他の方言を序列化することにつながる。,reason,wikipedia_ja_1_言語_chunk_12,wikipedia_ja_1_言語,wikipedia_ja,12,gemini
最も新しく、誕生の瞬間が捉えられた言語は何か？,ニカラグアの子供達の間で1970年代後半に発生した「ニカラグア手話」である。,fact,wikipedia_ja_1_言語_chunk_12,wikipedia_ja_1_言語,wikipedia_ja,12,gemini
「ニカラグア手話」の発生は、言語学においてどのような考えを裏付けるものとなったか？,言語能力は人間に生得のものであるという考えを裏付けるものとなった。,reason,wikipedia_ja_1_言語_chunk_12,wikipedia_ja_1_言語,wikipedia_ja,12,gemini
ルイス・ハーバート・グレイは、著書の中で何言語と唱えたか？,ルイス・ハーバート・グレイは「2796言語」と唱えた。,fact,wikipedia_ja_1_言語_chunk_12,wikipedia_ja_1_言語,wikipedia_ja,12,gemini
セルビア・クロアチア語は、学術的にはどのように扱われるか？,学術的には、方言連続体として扱われる。,fact,wikipedia_ja_1_言語_chunk_13,wikipedia_ja_1_言語,wikipedia_ja,13,gemini
ユーゴスラビア崩壊後、セルビア、クロアチア、ボスニアの言語はどのように扱われるようになったか？,各地方の方言がそれぞれ独立言語として扱われるようになり、セルビア語、クロアチア語、ボスニア語に分けられた。,fact,wikipedia_ja_1_言語_chunk_13,wikipedia_ja_1_言語,wikipedia_ja,13,gemini
ユーゴスラビアにおいて、セルビア、クロアチア、ボスニア・ヘルツェゴビナ、モンテネグロの言語が同一言語として扱われていた理由は何か？,国家統一の観点から、これらの言語は同一言語として扱われていた。,reason,wikipedia_ja_1_言語_chunk_13,wikipedia_ja_1_言語,wikipedia_ja,13,gemini
ある人間集団を「言語の話者」とするか「方言の話者」とするかの判断は、どのような問題と関連しているか？,似ているが同じではない「言語」が隣り合って存在しているとき、それが一つの言語なのか別の言語なのか区別することの難しさと関連している。,application,wikipedia_ja_1_言語_chunk_13,wikipedia_ja_1_言語,wikipedia_ja,13,gemini
複数中心地言語とはどのような言語ですか？,明確な標準語を持たず、複数の言語中心を持つ言語のことです。英語などが含まれます。,fact,wikipedia_ja_1_言語_chunk_14,wikipedia_ja_1_言語,wikipedia_ja,14,gemini
中国語の方言は、言語として独立していないのはなぜですか？,北京語などを元にした共通の書き言葉が存在し、各方言間の対応関係が明確であるため、中国語内の方言として扱われます。,reason,wikipedia_ja_1_言語_chunk_14,wikipedia_ja_1_言語,wikipedia_ja,14,gemini
