question,answer,question_type,source_chunk_id,doc_id,dataset_type,chunk_idx,provider
共通語のアクセントにおいて、弁別するポイントは何ですか？,共通語のアクセントでは、単語の中で音の下がる場所があるか、あるならば何モーラ目の直後に下がるかを弁別します。,fact,wikipedia_ja_2_日本語_chunk_27,wikipedia_ja_2_日本語,wikipedia_ja,27,gemini
アクセントの滝とは何ですか？,音が下がる箇所をアクセントの滝といいます。,fact,wikipedia_ja_2_日本語_chunk_28,wikipedia_ja_2_日本語,wikipedia_ja,28,gemini
アクセント核が存在しないアクセントの型は何と呼ばれますか？,アクセント核が存在しない型は、平板型と呼ばれます。,fact,wikipedia_ja_2_日本語_chunk_28,wikipedia_ja_2_日本語,wikipedia_ja,28,gemini
なぜ頭高型・中高型・尾高型をまとめて起伏式と呼ぶのですか？,これらの型はアクセント核を持ち、音の高さに起伏があるため、起伏式と呼ばれます。,reason,wikipedia_ja_2_日本語_chunk_28,wikipedia_ja_2_日本語,wikipedia_ja,28,gemini
「犬」という単語にアクセント核がある場合、どのようなアクセントの型になり得ますか？,「犬」は2拍語なので、頭高型（イヌ）か尾高型（イヌ↓）のいずれかになります。,application,wikipedia_ja_2_日本語_chunk_28,wikipedia_ja_2_日本語,wikipedia_ja,28,gemini
共通語のアクセントにおいて、単語や文節のみを発音した場合、どのような音の上昇が見られるか？,1拍目から2拍目にかけて音の上昇が見られる（頭高型を除く）。,fact,wikipedia_ja_2_日本語_chunk_29,wikipedia_ja_2_日本語,wikipedia_ja,29,gemini
句音調とは何か？,句音調とは、文中で区切らずに発音したひとまとまり（句）の始めに現れる音の上昇であり、句と句の切れ目を分かりやすくする機能を担う。,definition,wikipedia_ja_2_日本語_chunk_29,wikipedia_ja_2_日本語,wikipedia_ja,29,gemini
共通語の音調はどのように変化するか？,句の2拍目から上昇し（句の最初の単語が頭高型の場合は1拍目から上昇する）、アクセント核まで平らに進み、核の後で下がる。,fact,wikipedia_ja_2_日本語_chunk_29,wikipedia_ja_2_日本語,wikipedia_ja,29,gemini
共通語の音調において、句頭で「低低高高…」や「高高高高…」のような音調が現れないのはなぜか？,句の音調は、句の2拍目から上昇する、または句の最初の単語が頭高型の場合は1拍目から上昇するという規則があるため。,reason,wikipedia_ja_2_日本語_chunk_29,wikipedia_ja_2_日本語,wikipedia_ja,29,gemini
アクセント辞典で「し」「たごが」のように表記されるアクセントは何を表しているか？,これは1文節を1つの句として発音する際の句音調とアクセント核を同時に表記したものである。,fact,wikipedia_ja_2_日本語_chunk_30,wikipedia_ja_2_日本語,wikipedia_ja,30,gemini
日本語の文法的な性質として、膠着語であることの他にどのような特徴があるか？,日本語は膠着語であり、主語＋目的語＋動詞（SOV)を語順とする構成的言語である。,fact,wikipedia_ja_2_日本語_chunk_30,wikipedia_ja_2_日本語,wikipedia_ja,30,gemini
日本語の文の構造（語順）は、英語の文の構造と比較してどのように異なるか？,英語の文の構造がSVO型であるのに対し、日本語の文の構造はSOV型である。,comparison,wikipedia_ja_2_日本語_chunk_30,wikipedia_ja_2_日本語,wikipedia_ja,30,gemini
日本語が主題優勢言語であるとは、具体的に文の構造にどのような影響を与えると考えられるか？,主題優勢言語であることは、文の要素の配置や文全体の意味構造に影響を与える。,application,wikipedia_ja_2_日本語_chunk_30,wikipedia_ja_2_日本語,wikipedia_ja,30,gemini
日本語文の基本的な構造を「S（主語）‐V（動詞）」ではなく「S（主語）‐P（述語）」と考える方が適当な理由は何ですか？,日本語文は動詞で終わるだけでなく、形容詞や名詞+助動詞で終わることもあるため、より包括的な「主述構造」として捉える方が適切です。,reason,wikipedia_ja_2_日本語_chunk_31,wikipedia_ja_2_日本語,wikipedia_ja,31,gemini
日本語の「私は（が） 社長だ」「私は（が） 行く」「私は（が） 嬉しい」という文に共通する構造は何ですか？,これらの文はすべて「S‐P」構造、すなわち主述構造をなす同一の文型です。,fact,wikipedia_ja_2_日本語_chunk_31,wikipedia_ja_2_日本語,wikipedia_ja,31,gemini
英語と日本語の文型を比較した場合、日本語話者の英語学習者はどのような誤った作文をする傾向がありますか？,日本語話者は、日本語の文型に本質的な違いがないため、「私は（が） 社長だ」「私は（が） 行く」と同じ調子で誤った英語の作文をすることがあります。,comparison,wikipedia_ja_2_日本語_chunk_31,wikipedia_ja_2_日本語,wikipedia_ja,31,gemini
英語の文型を参考に、日本語の文を名詞文、動詞文、形容詞文と分けることは可能ですか？,英語の文型を参考に分けることは可能ですが、日本語ではこれらの文型に本質的な違いはありません。,application,wikipedia_ja_2_日本語_chunk_31,wikipedia_ja_2_日本語,wikipedia_ja,31,gemini
題述構造における「題目」とは何ですか？,題目は話のテーマ（主題）を明示するものです。,fact,wikipedia_ja_2_日本語_chunk_32,wikipedia_ja_2_日本語,wikipedia_ja,32,gemini
主語と題目の違いは何ですか？,主語は動作や作用の主体を表すのに対し、題目は文が何について述べるかを明らかにします。,comparison,wikipedia_ja_2_日本語_chunk_32,wikipedia_ja_2_日本語,wikipedia_ja,32,gemini
日本語文において題目が「は」で表される理由は何ですか？,「は」は、その文が「これから何について述べるのか」を明らかにする役割を持つため、題目を表すのに用いられます。,reason,wikipedia_ja_2_日本語_chunk_32,wikipedia_ja_2_日本語,wikipedia_ja,32,gemini
題目が同時に目的語でもある文では、結果的に何が起こりますか？,題目に「は」が付くことにより、結果的に目的語に「は」が付きます。,fact,wikipedia_ja_2_日本語_chunk_32,wikipedia_ja_2_日本語,wikipedia_ja,32,gemini
文中の「象は」が題目を示す例として、テキストではどのような文が挙げられていますか？,「象は おりに入れた」「象は えさをやった」「象は 鼻が長い」などの文が挙げられています。,fact,wikipedia_ja_2_日本語_chunk_33,wikipedia_ja_2_日本語,wikipedia_ja,33,gemini
「象は」が題目を表すとき、どのような役割を果たしますか？,特定の格を示すのではなく、「私は象について述べる」ということを明示する役割を持ちます。,reason,wikipedia_ja_2_日本語_chunk_33,wikipedia_ja_2_日本語,wikipedia_ja,33,gemini
テキストによると、大野晋は何と何がそれぞれ未知と既知を表すと主張しましたか？,大野晋は「が」と「は」がそれぞれ未知と既知を表すと主張しました。,fact,wikipedia_ja_2_日本語_chunk_33,wikipedia_ja_2_日本語,wikipedia_ja,33,gemini
題目「象は」に続く部分は、文法的に何と呼ばれますか？,題目「象は」に続く部分は、述部と呼ばれます。,fact,wikipedia_ja_2_日本語_chunk_33,wikipedia_ja_2_日本語,wikipedia_ja,33,gemini
「私が佐藤です」という文において、前者の「私が佐藤です」と後者の「私が佐藤です」は何が異なりますか？,前者は佐藤がどの人物かを示す未知の情報を示し、後者は既に既知である私が誰かを示す情報を示します。,comparison,wikipedia_ja_2_日本語_chunk_34,wikipedia_ja_2_日本語,wikipedia_ja,34,gemini
なぜ「何は」「どこは」「いつは」という表現は不自然なのですか？,「何」「どこ」「いつ」といった疑問詞は常に未知の情報を指すため、「〜は」とすることで既知の情報との矛盾が生じるからです。,reason,wikipedia_ja_2_日本語_chunk_34,wikipedia_ja_2_日本語,wikipedia_ja,34,gemini
ジョーゼフ・グリーンバーグの構成素順理論において、句には何が含まれますか？,句には主要部が含まれ、場合によっては修飾語が同句に含まれます。,fact,wikipedia_ja_2_日本語_chunk_34,wikipedia_ja_2_日本語,wikipedia_ja,34,gemini
主要部先導型と主要部終端型の違いは何ですか？,主要部先導型は修飾語の前に主要部が位置し、主要部終端型は修飾語の後ろに主要部が位置します。,fact,wikipedia_ja_2_日本語_chunk_34,wikipedia_ja_2_日本語,wikipedia_ja,34,gemini
英語の属句にはどのような2つのタイプが存在しますか？,英語の属句には主要部先導型と主要部終端型の2つのタイプが存在し得ます。,fact,wikipedia_ja_2_日本語_chunk_35,wikipedia_ja_2_日本語,wikipedia_ja,35,gemini
日本語が主要部終端型言語であることは、どのような点に現れていますか？,日本語の主要部終端型の性質は、属句や接置詞に支配された名詞の構造、さらには複文などの文章単位での構成に見られます。,reason,wikipedia_ja_2_日本語_chunk_35,wikipedia_ja_2_日本語,wikipedia_ja,35,gemini
英語と日本語における形容詞で修飾された名詞の語順を比較してください。,英語では形容詞は名詞の前に位置しますが（例: black cat）、日本語では形容詞は名詞の後に位置します（例: 黒い猫）。,comparison,wikipedia_ja_2_日本語_chunk_35,wikipedia_ja_2_日本語,wikipedia_ja,35,gemini
主要部終端型言語である日本語において、「犬の散歩」という属句を英語で表現してください。,"英語では主要部先導型と主要部終端型の両方が可能なため、""the walk of the dog""または""the dog's walk""と表現できます。",application,wikipedia_ja_2_日本語_chunk_35,wikipedia_ja_2_日本語,wikipedia_ja,35,gemini
日本語の文章において、従属節は主要部の前に位置する理由は何ですか？,従属節は修飾部であり、修飾する文が主要部を擁しているため、日本語では従属節が常に先行します。,reason,wikipedia_ja_2_日本語_chunk_36,wikipedia_ja_2_日本語,wikipedia_ja,36,gemini
英語の「the man who was walking down the street」を日本語に訳す際、英語の従属節はどこに配置する必要がありますか？,英語の従属節「(who) was walking down the street」は、主要部である「the man」の前に位置させる必要があります。,fact,wikipedia_ja_2_日本語_chunk_36,wikipedia_ja_2_日本語,wikipedia_ja,36,gemini
重文構造において、英語は日本語と比べてどのような傾向がありますか？,英語は重文構造において、構成節の繰り返しを避ける傾向があります。,comparison,wikipedia_ja_2_日本語_chunk_36,wikipedia_ja_2_日本語,wikipedia_ja,36,gemini
英語の文「Bob bought his mother some flowers and bought his father a tie」を、重文構造における英語の一般的な傾向に従って書き換えてください。,「Bob bought his mother some flowers and his father a tie」となります。,application,wikipedia_ja_2_日本語_chunk_36,wikipedia_ja_2_日本語,wikipedia_ja,36,gemini
日本語の文章において、動詞の省略が起こりやすいのはなぜですか？,日本語の文章は基本的に動詞で終わる性質を持つため、文脈から明らかな場合、初めの動詞が省略される傾向があります。,reason,wikipedia_ja_2_日本語_chunk_37,wikipedia_ja_2_日本語,wikipedia_ja,37,gemini
三上章が唱えた「主語廃止論」とはどのような提案ですか？,三上章は、日本語の文において「主語」という文法用語の使用をやめることを提案しました。,fact,wikipedia_ja_2_日本語_chunk_37,wikipedia_ja_2_日本語,wikipedia_ja,37,gemini
「象は鼻が長い。」のような文を「主語‐述語」ではなく「題目‐述部」と捉えるべきだと考えるのはなぜですか？,このような文では、主語が必須ではなく、文全体のテーマ（題目）と、それに対する説明（述部）として捉える方が自然であるためです。,reason,wikipedia_ja_2_日本語_chunk_37,wikipedia_ja_2_日本語,wikipedia_ja,37,gemini
「甲ガ乙ニ丙ヲ紹介シタ。」という文において、三上章は何が重要だと考えましたか？,三上章は、「甲ガ」「乙ニ」「丙ヲ」をまとめる述語「紹介シタ」の部分が重要だと考えました。,fact,wikipedia_ja_2_日本語_chunk_37,wikipedia_ja_2_日本語,wikipedia_ja,37,gemini
「甲ガ」「乙ニ」「丙ヲ」は文法的にどのような役割を果たすか？,これらはすべて述語を補足する語（補語）として機能する。,fact,wikipedia_ja_2_日本語_chunk_38,wikipedia_ja_2_日本語,wikipedia_ja,38,gemini
日本語の文法において、主語を省略しても文として成立するのはなぜか？,日本語では述語が中心であり、補語を必要に応じて付け足すという考え方のため、主語がなくても完全な文と見なせる。,reason,wikipedia_ja_2_日本語_chunk_38,wikipedia_ja_2_日本語,wikipedia_ja,38,gemini
日本語の文法における主語の概念は、英語の文法と比較してどのような違いがあるか？,英語の主語は述語と人称などで呼応する特別な存在だが、日本語では述語が中心で主語は必須ではない。,comparison,wikipedia_ja_2_日本語_chunk_38,wikipedia_ja_2_日本語,wikipedia_ja,38,gemini
「ハマチの成長したものをブリという」という文は、従来の英語式の文法観点からはどのように解釈されるか？,英語式の観点からは、この文は「主語が省略されている」と解釈される。,application,wikipedia_ja_2_日本語_chunk_38,wikipedia_ja_2_日本語,wikipedia_ja,38,gemini
三上の説に対して、日本語の文に主語が必須であると主張する学説は、どのような学派を除いて少数派ですか？,生成文法や鈴木重幸らの言語学研究会グループなど、主語に統語上の重要な役割を認める学派を除いて少数派です。,fact,wikipedia_ja_2_日本語_chunk_39,wikipedia_ja_2_日本語,wikipedia_ja,39,gemini
森重敏は、日本語の文において何が骨子であるという立場をとっていますか？,日本語の文においても主述関係が骨子であるという立場をとっていますが、その主語・述語は一般に言われるものとは様相を異にしています。,fact,wikipedia_ja_2_日本語_chunk_39,wikipedia_ja_2_日本語,wikipedia_ja,39,gemini
学校文法では、どのような文法用語を用いるのが普通ですか？,学校文法では、主語・述語を基本とした伝統的な文法用語を用いるのが普通です。,fact,wikipedia_ja_2_日本語_chunk_39,wikipedia_ja_2_日本語,wikipedia_ja,39,gemini
文の構造を十分に説明するために、主語と述語以外に必要な要素は何ですか？,主語と述語に加えて、修飾語などの要素が必要です。,fact,wikipedia_ja_2_日本語_chunk_39,wikipedia_ja_2_日本語,wikipedia_ja,39,gemini
学校文法で文の成分として挙げられているものは何ですか？,学校文法では、文の成分として「主語」「述語」「修飾語」「接続語」「独立語」の5つが挙げられています。,fact,wikipedia_ja_2_日本語_chunk_40,wikipedia_ja_2_日本語,wikipedia_ja,40,gemini
なぜ学校文法では「並立語」や「補助語」という用語を使用しないのですか？,学校文法では、「並立語」「補助語」は文節/連文節どうしの関係を示す概念であり、常に連文節として他の成分になるため、文の成分としては扱いません。,reason,wikipedia_ja_2_日本語_chunk_40,wikipedia_ja_2_日本語,wikipedia_ja,40,gemini
学校文法における「並立の関係」と「補助の関係」はそれぞれ何を表していますか？,「並立の関係」は文節または連文節同士が対等な関係にあることを、「補助の関係」は文節または連文節が互いに意味を補い合っていることを表します。,definition,wikipedia_ja_2_日本語_chunk_40,wikipedia_ja_2_日本語,wikipedia_ja,40,gemini
連体修飾語は単独で文の成分になりえますか？,いいえ、連体修飾語は単独では文の成分にならず、常に被修飾語と連文節を構成して文の成分となります。,fact,wikipedia_ja_2_日本語_chunk_40,wikipedia_ja_2_日本語,wikipedia_ja,40,gemini
学校図書を除く教科書における単文節と連文節の呼び方は？,単文節でできているものを「-語」、連文節でできているものを「-部」と呼んでいます。,fact,wikipedia_ja_2_日本語_chunk_41,wikipedia_ja_2_日本語,wikipedia_ja,41,gemini
学校図書における文節/連文節の関係概念の呼び方は？,学校図書では、文節/連文節どうしの関係概念を「-語」と呼んでいます。,fact,wikipedia_ja_2_日本語_chunk_41,wikipedia_ja_2_日本語,wikipedia_ja,41,gemini
文を成り立たせる基本的な成分とは？,文を成り立たせる基本的な成分は主語と述語です。,fact,wikipedia_ja_2_日本語_chunk_41,wikipedia_ja_2_日本語,wikipedia_ja,41,gemini
連用修飾語は何に係る修飾語ですか？,連用修飾語は用言に係る修飾語です。,fact,wikipedia_ja_2_日本語_chunk_41,wikipedia_ja_2_日本語,wikipedia_ja,41,gemini
「弟に算数を教える」という文において、「弟に」「算数を」は何と呼ばれるか？,述語の動詞「教える」にかかる連用修飾語と呼ばれる。,fact,wikipedia_ja_2_日本語_chunk_42,wikipedia_ja_2_日本語,wikipedia_ja,42,gemini
補充成分と修飾成分の違いは何か？,補充成分は文の根幹をなし、欠けると基本的な事実関係が伝わらない。一方、修飾成分は欠いても事実の伝達にそれほど支障がない。,comparison,wikipedia_ja_2_日本語_chunk_42,wikipedia_ja_2_日本語,wikipedia_ja,42,gemini
「算数をみっちり教える」の「みっちり」は、文法上何と呼ばれるか？,動詞「教える」にかかる連用修飾語。,fact,wikipedia_ja_2_日本語_chunk_42,wikipedia_ja_2_日本語,wikipedia_ja,42,gemini
連体修飾語の例を３つ挙げてください。,「私の本」の「私の」、「動く歩道」の「動く」、「赤い髪飾り」の「赤い」などが連体修飾語の例です。,fact,wikipedia_ja_2_日本語_chunk_42,wikipedia_ja_2_日本語,wikipedia_ja,42,gemini
鈴木重幸らは、連体修飾語を何と呼んでいますか？,鈴木重幸らは、連体修飾語を「規定語」（または「連体規定語」）と呼んでいます。,fact,wikipedia_ja_2_日本語_chunk_43,wikipedia_ja_2_日本語,wikipedia_ja,43,gemini
接続語の例を挙げてください。,「疲れたので、動けない。」の「疲れたので」や、「今日は晴れた。だから、ピクニックに行こう。」の「だから」などが接続語の例です。,fact,wikipedia_ja_2_日本語_chunk_43,wikipedia_ja_2_日本語,wikipedia_ja,43,gemini
品詞分類において、接続詞はどのような品詞ですか？,品詞分類では、常に接続語となる品詞を接続詞と分類します。,fact,wikipedia_ja_2_日本語_chunk_43,wikipedia_ja_2_日本語,wikipedia_ja,43,gemini
独立語は文中でどのような役割を果たしますか？,独立語は、文中の他の部分に係ったり、他の部分を受けたりすることなく、独立して存在します。,fact,wikipedia_ja_2_日本語_chunk_43,wikipedia_ja_2_日本語,wikipedia_ja,43,gemini
独立語としてのみ用いられる品詞は何ですか？,独立語としてのみ用いられる品詞は感動詞です。,fact,wikipedia_ja_2_日本語_chunk_44,wikipedia_ja_2_日本語,wikipedia_ja,44,gemini
並立語の全体としての働きは、文のどの部分に相当することがありますか？,並立語は、連用修飾部や述部に相当することがあります。,fact,wikipedia_ja_2_日本語_chunk_44,wikipedia_ja_2_日本語,wikipedia_ja,44,gemini
現行の学校文法では、英語にあるような目的語や補語といった成分はどのように扱われますか？,現行の学校文法では、英語にあるような目的語や補語といった成分はないとされています。,fact,wikipedia_ja_2_日本語_chunk_44,wikipedia_ja_2_日本語,wikipedia_ja,44,gemini
日本語の「私は本を読む」という文において、「本を」は英語の文法ではどのような要素として考えられますか？,英語文法では、「I read a book.」の「a book」はSVO文型の一部をなす目的語と考えられます。,comparison,wikipedia_ja_2_日本語_chunk_44,wikipedia_ja_2_日本語,wikipedia_ja,44,gemini
学校文法において、「私は本を読む」はどのような文型として解釈されるか？,学校文法では、「主語‐目的語‐動詞」(SOV) 文型というよりは、「主語‐修飾語‐述語」文型と解釈される。,fact,wikipedia_ja_2_日本語_chunk_45,wikipedia_ja_2_日本語,wikipedia_ja,45,gemini
鈴木重幸・鈴木康之らは、連用修飾語のうち目的語に当たる語を何と定義しているか？,彼らは、述語の表す動きや状態の成立に加わる対象を表す「対象語」と定義し、文の基本成分として認めている。,fact,wikipedia_ja_2_日本語_chunk_45,wikipedia_ja_2_日本語,wikipedia_ja,45,gemini
高橋太郎・鈴木泰・工藤真由美らが「補語」と呼ぶ文の成分は、鈴木重幸・鈴木康之らの言う「対象語」とどのような関係にあるか？,両者は同じ文の成分を指しており、主語・述語が表す事柄の組み立てを明示するために、その成り立ちに参加する物を補うという機能の観点から名称が異なる。,comparison,wikipedia_ja_2_日本語_chunk_45,wikipedia_ja_2_日本語,wikipedia_ja,45,gemini
「明日、学校で運動会がある」という文における「明日」は、文の成分として何に分類されるか？,「明日、学校で運動会がある」の「明日」は、出来事の状況を表すため、「状況語」に分類される。,application,wikipedia_ja_2_日本語_chunk_45,wikipedia_ja_2_日本語,wikipedia_ja,45,gemini
状況語とは、どのような文の成分を指しますか？,出来事や有様の成り立つ状況を述べるために、時や場所、原因や目的を示す文の成分を指します。,fact,wikipedia_ja_2_日本語_chunk_46,wikipedia_ja_2_日本語,wikipedia_ja,46,gemini
状況語は、文中でどのような役割を果たしますか？,状況語は、出来事や有様を表す部分の外的な状況を表す「とりまき」ないしは「額縁」の役目を果たします。,reason,wikipedia_ja_2_日本語_chunk_46,wikipedia_ja_2_日本語,wikipedia_ja,46,gemini
学校文法における連用修飾語と状況語の違いは何ですか？,連用修飾語は述語の表す内的な属性を表すのに対し、状況語は外的な状況を表します。,comparison,wikipedia_ja_2_日本語_chunk_46,wikipedia_ja_2_日本語,wikipedia_ja,46,gemini
「雨だから学校に遅刻した」という文において、状況語はどれですか？,この文における状況語は「雨だから」です。,application,wikipedia_ja_2_日本語_chunk_46,wikipedia_ja_2_日本語,wikipedia_ja,46,gemini
「ぐんぐん進む」という表現において、「ぐんぐん」は何を修飾していますか？,「ぐんぐん」は「進む」という動詞を修飾しています。,fact,wikipedia_ja_2_日本語_chunk_47,wikipedia_ja_2_日本語,wikipedia_ja,47,gemini
日本国憲法前文の例で、文意が取りにくい理由は何ですか？,主語と述語の間に長い修飾語が挟まっているため、文構造が把握しづらくなっています。,reason,wikipedia_ja_2_日本語_chunk_47,wikipedia_ja_2_日本語,wikipedia_ja,47,gemini
日本語の修飾語の位置と英語の修飾語の位置にはどのような違いがありますか？,日本語では修飾語が前に置かれることが多いですが、英語では後置されることもあります。ただし、英語でも修飾関係が分かりにくい文が現れることがあります。,comparison,wikipedia_ja_2_日本語_chunk_47,wikipedia_ja_2_日本語,wikipedia_ja,47,gemini
法律文や翻訳文で長い修飾語を使うことのデメリットは何ですか？,長い修飾語を主語と述語の間に挟むことで、文意が取りにくくなるというデメリットがあります。,application,wikipedia_ja_2_日本語_chunk_47,wikipedia_ja_2_日本語,wikipedia_ja,47,gemini
