question,answer,question_type,source_chunk_id,doc_id,dataset_type,chunk_idx,provider
幕末から明治時代にかけて、外来語の中心となっていた言語は何ですか？,英語が中心となっていました。,fact,wikipedia_ja_2_日本語_chunk_129,wikipedia_ja_2_日本語,wikipedia_ja,129,gemini
今日では一般に使われないものの、当時使われていた外来語の例を挙げてください。,「ステンション（駅）」や「テレガラフ（電信）」などがあります。,fact,wikipedia_ja_2_日本語_chunk_129,wikipedia_ja_2_日本語,wikipedia_ja,129,gemini
坪内逍遥『当世書生気質』には、どのような形で英語が登場しますか？,書生のせりふの中に、「ウオッチ」「プレテキスト」「セブン」「ポウン」「セル」などの英語が使われています。,fact,wikipedia_ja_2_日本語_chunk_130,wikipedia_ja_2_日本語,wikipedia_ja,130,gemini
第二次世界大戦中、外来語が禁止または自粛されたのはなぜですか？,テキストからは、外来語禁止・自粛の理由は明示されていません。戦争激化に伴う排他的な風潮が背景にあったと考えられます。,reason,wikipedia_ja_2_日本語_chunk_130,wikipedia_ja_2_日本語,wikipedia_ja,130,gemini
戦前と戦後で、外来語の流入にどのような違いがありましたか？,戦後はアメリカ発の外来語が爆発的に増加しました。,comparison,wikipedia_ja_2_日本語_chunk_130,wikipedia_ja_2_日本語,wikipedia_ja,130,gemini
現代において、外来語が急速に広まる理由は何ですか？,報道、交通機関、通信技術の発達によって、新しい外来語が瞬時に広まる状況が生まれています。,reason,wikipedia_ja_2_日本語_chunk_130,wikipedia_ja_2_日本語,wikipedia_ja,130,gemini
漢語が日本語に取り入れられた結果、特に語彙が増大した品詞は何ですか？,名詞、サ変動詞、形容動詞の語彙が特に増大しました。,fact,wikipedia_ja_2_日本語_chunk_131,wikipedia_ja_2_日本語,wikipedia_ja,131,gemini
漢語が日本語に取り入れられたことで、どのような表現が可能になりましたか？,厳密な概念を簡潔に表現することが可能になりました。,reason,wikipedia_ja_2_日本語_chunk_131,wikipedia_ja_2_日本語,wikipedia_ja,131,gemini
和語の「とる」と、漢語の「取得する」「摂取する」などの違いは何ですか？,和語の「とる」は広い意味で使われるのに対し、漢語はより細かく意味を区別して表現できます。,comparison,wikipedia_ja_2_日本語_chunk_131,wikipedia_ja_2_日本語,wikipedia_ja,131,gemini
「記録する」を漢語のサ変動詞として用いた例文を挙げてください。,例：出来事を詳細に記録す。,application,wikipedia_ja_2_日本語_chunk_131,wikipedia_ja_2_日本語,wikipedia_ja,131,gemini
日本語の「きよい」という形容詞は、漢語を用いることでどのように表現が厳密になったか？,「清潔だ」「清浄だ」「清澄だ」「清冽だ」「清純だ」などの形容動詞によって、より厳密に表現できるようになった。,reason,wikipedia_ja_2_日本語_chunk_132,wikipedia_ja_2_日本語,wikipedia_ja,132,gemini
外来語は漢語と同様に、日本語の語彙を豊富にしたが、どのような品詞で特に貢献したか？,名詞、サ変動詞、形容動詞の部分で日本語の語彙を豊富にした。,fact,wikipedia_ja_2_日本語_chunk_132,wikipedia_ja_2_日本語,wikipedia_ja,132,gemini
漢語・外来語の増加によって、形容詞と形容動詞の勢力はどのように変化したか？,漢語・外来語の増加によって、形容詞と形容動詞の勢力が逆転し、形容動詞が数を増やした。,comparison,wikipedia_ja_2_日本語_chunk_132,wikipedia_ja_2_日本語,wikipedia_ja,132,gemini
「スケッチする」「サービスする」は、外来語がどのような品詞として用いられた例か？,「スケッチする」「サービスする」は、外来語がサ変動詞として用いられた例である。,application,wikipedia_ja_2_日本語_chunk_132,wikipedia_ja_2_日本語,wikipedia_ja,132,gemini
現代語において、形容動詞が形容詞を上回るに至った理由は何ですか？,漢語・外来語を語幹とした形容動詞が漸増したため、現代語では形容動詞が形容詞を上回るようになりました。,reason,wikipedia_ja_2_日本語_chunk_133,wikipedia_ja_2_日本語,wikipedia_ja,133,gemini
形容詞の造語力について、現代ではどのような状況ですか？,形容詞の造語力は今日ではほとんど失われており、近代以降の新しい形容詞の例はわずかしかありません。,fact,wikipedia_ja_2_日本語_chunk_133,wikipedia_ja_2_日本語,wikipedia_ja,133,gemini
形容詞と形容動詞の造語力にはどのような違いがありますか？,形容詞の造語力はほとんど失われているのに対し、形容動詞は今日に至るまで高い造語力を保っています。,comparison,wikipedia_ja_2_日本語_chunk_133,wikipedia_ja_2_日本語,wikipedia_ja,133,gemini
本文を参考に、形容詞の造語力が失われている状況下で、新たに作られた形容詞の例を挙げてください。,近代以降に作られた形容詞の例としては、「甘酸っぱい」「黄色い」「四角い」「粘っこい」などがあります。,fact,wikipedia_ja_2_日本語_chunk_133,wikipedia_ja_2_日本語,wikipedia_ja,133,gemini
形容動詞の語源として、和語、漢語、外来語の割合はそれぞれどの程度ですか？,現代雑誌の調査では、形容動詞で語種のはっきりしているもののうち、和語は約2割、漢語は約3割強、外来語は約4割強です。,fact,wikipedia_ja_2_日本語_chunk_134,wikipedia_ja_2_日本語,wikipedia_ja,134,gemini
接尾語「的」を付けた語や外来語由来の語が近代以降の新語である理由は何ですか？,これらの語は、明治以降の西洋文化の流入や、新しい概念を表現する必要性から生まれたため、近代以降に多く使われるようになりました。,reason,wikipedia_ja_2_日本語_chunk_134,wikipedia_ja_2_日本語,wikipedia_ja,134,gemini
日本で本格的に漢字が使用されるようになったのはいつ頃だと考えられますか？,福岡市出土の「漢委奴国王印」など漢字の記された遺物はあるものの、本格的な使用はそれよりも後年だと考えられています。,fact,wikipedia_ja_2_日本語_chunk_134,wikipedia_ja_2_日本語,wikipedia_ja,134,gemini
王仁は日本に何をもたらしましたか？,王仁は応神天皇の時代に「論語十巻、千字文一巻」を携えて来日したと古事記に記されています。,fact,wikipedia_ja_2_日本語_chunk_134,wikipedia_ja_2_日本語,wikipedia_ja,134,gemini
稲荷山古墳出土の鉄剣銘には、誰と目される人名を含む漢字が刻まれていますか？,雄略天皇と目される人名を含む漢字が刻まれています。,fact,wikipedia_ja_2_日本語_chunk_135,wikipedia_ja_2_日本語,wikipedia_ja,135,gemini
漢字使用域が拡大した理由は何ですか？,大和政権の勢力伸長とともに、儒教、仏教、道教などを漢文で読む必要が出てきたため、識字層が広がり漢字使用域が拡大しました。,reason,wikipedia_ja_2_日本語_chunk_135,wikipedia_ja_2_日本語,wikipedia_ja,135,gemini
万葉仮名とはどのような表記方法ですか？,日本語の1音1音を漢字の音や訓を借りて写す表記方法で、「波都波流能（はつはるの）」のように表現されます。,definition,wikipedia_ja_2_日本語_chunk_135,wikipedia_ja_2_日本語,wikipedia_ja,135,gemini
草仮名から平仮名が生まれる過程を説明してください。,9世紀に万葉仮名の字体を崩した草仮名が生まれ、さらに草仮名を崩したものが平仮名となりました。,process,wikipedia_ja_2_日本語_chunk_135,wikipedia_ja_2_日本語,wikipedia_ja,135,gemini
平仮名が自由に操られた王朝文学は、何世紀頃に頂点を迎えましたか？,11世紀に『源氏物語』などの物語作品群で頂点を迎えました。,fact,wikipedia_ja_2_日本語_chunk_136,wikipedia_ja_2_日本語,wikipedia_ja,136,gemini
ヲコト点とは、どのような目的で使用されていたものですか？,僧侶や学者らが漢文を訓読する際に、助詞などを表すために漢字の隅に打たれた点です。,reason,wikipedia_ja_2_日本語_chunk_136,wikipedia_ja_2_日本語,wikipedia_ja,136,gemini
片仮名と平仮名は、発生当初どのような点が共通していましたか？,どちらも1つの音価に対して複数の文字が使われていました。,comparison,wikipedia_ja_2_日本語_chunk_136,wikipedia_ja_2_日本語,wikipedia_ja,136,gemini
小学校で教える仮名が1字1音に整理されたのはいつですか？,1900年（明治33年）に「小学校令施行規則」が出されたことによります。,fact,wikipedia_ja_2_日本語_chunk_136,wikipedia_ja_2_日本語,wikipedia_ja,136,gemini
変体仮名は現在でもどのような場所で見られることがありますか？,料理屋の名などに使われることがあります。,fact,wikipedia_ja_2_日本語_chunk_137,wikipedia_ja_2_日本語,wikipedia_ja,137,gemini
平安時代に発音と仮名が1対1で対応しなくなった理由は何ですか？,発音の変化に伴って、発音と仮名が一致しなくなったためです。,reason,wikipedia_ja_2_日本語_chunk_137,wikipedia_ja_2_日本語,wikipedia_ja,137,gemini
平安時代初期における「はな」の「は」と「かは」の「は」の発音の違いは何ですか？,平安時代初期にはいずれも「ファ」であったとみられます。,fact,wikipedia_ja_2_日本語_chunk_137,wikipedia_ja_2_日本語,wikipedia_ja,137,gemini
仮名遣いの問題が発生した結果、具体的にどのような判断が不明確になりましたか？,「カワ」という発音を表記する際に、「かわ」と「かは」のどちらを使用すべきかの判断基準が不明確になりました。,reason,wikipedia_ja_2_日本語_chunk_137,wikipedia_ja_2_日本語,wikipedia_ja,137,gemini
明治時代に学校教育が始まるまで、万人向けの仮名遣い規範は存在しましたか？,いいえ、明治に学校教育が始まるまで、万人向けの仮名遣い規範は存在しませんでした。,fact,wikipedia_ja_2_日本語_chunk_138,wikipedia_ja_2_日本語,wikipedia_ja,138,gemini
小学校令施行規則（1900年）において採用された「棒引き仮名遣い」とはどのようなものですか？,漢字音を発音通りにする仮名遣いのことで、「にんぎやう（人形）」を「にんぎょー」とするようなものです。,definition,wikipedia_ja_2_日本語_chunk_138,wikipedia_ja_2_日本語,wikipedia_ja,138,gemini
『尋常小学読本』（第1期）で採用された棒引き仮名遣いは、その後どうなりましたか？,評判が悪く、規則の改正とともに元の仮名遣いに戻されました。,fact,wikipedia_ja_2_日本語_chunk_138,wikipedia_ja_2_日本語,wikipedia_ja,138,gemini
第二次世界大戦後の1946年に内閣告示されたものは何ですか？,「当用漢字表」と「現代かなづかい」が内閣告示されました。,fact,wikipedia_ja_2_日本語_chunk_138,wikipedia_ja_2_日本語,wikipedia_ja,138,gemini
1946年と1950年の米教育使節団報告書では、国語に関してどのような勧告がされましたか？,国字のローマ字化について勧告および示唆が行われましたが、実現には至りませんでした。,fact,wikipedia_ja_2_日本語_chunk_139,wikipedia_ja_2_日本語,wikipedia_ja,139,gemini
GHQの民間情報教育局 (CIE) が読み書き能力調査を行った理由は何ですか？,漢字が日本人の識字率を抑えているという考え方に基づいて調査が行われました。,reason,wikipedia_ja_2_日本語_chunk_139,wikipedia_ja_2_日本語,wikipedia_ja,139,gemini
当用漢字表と常用漢字表の主な違いは何ですか？,常用漢字表は、当用漢字表に比べて制限色が薄められています。,comparison,wikipedia_ja_2_日本語_chunk_139,wikipedia_ja_2_日本語,wikipedia_ja,139,gemini
現代の学校教育において、送り仮名の付け方を学ぶことはなぜ重要ですか？,送り仮名の付け方は、1973年に内閣告示され、今日に至るまで公式な基準となっているため、正しい日本語表記に不可欠です。,application,wikipedia_ja_2_日本語_chunk_139,wikipedia_ja_2_日本語,wikipedia_ja,139,gemini
平安時代までの朝廷における公の書き言葉は何でしたか？,平安時代までの朝廷で用いる公の書き言葉は漢文でした。,fact,wikipedia_ja_2_日本語_chunk_140,wikipedia_ja_2_日本語,wikipedia_ja,140,gemini
漢文訓読の習慣によって、どのような文体が生じましたか？,漢文訓読の習慣に伴い、漢文に日本語特有の語句を混ぜたり、一部を日本語の語順で記したりした「和化漢文」が生じました。,fact,wikipedia_ja_2_日本語_chunk_140,wikipedia_ja_2_日本語,wikipedia_ja,140,gemini
なぜ当初の漢文は中国語音で読まれなくなったのですか？,日本語と中国語の音韻体系は相違が大きいため、中国語音で読む方法はやがて廃れました。,reason,wikipedia_ja_2_日本語_chunk_140,wikipedia_ja_2_日本語,wikipedia_ja,140,gemini
和化漢文の例として挙げられているものを具体的に一つ挙げてください。,6世紀の法隆寺薬師仏光背銘が、和化漢文の例として挙げられます。,fact,wikipedia_ja_2_日本語_chunk_140,wikipedia_ja_2_日本語,wikipedia_ja,140,gemini
「宣命書き」という文体が、祝詞や宣命などに見られる理由は何ですか？,祝詞や宣命の文体に類似しているため、「宣命書き」と呼ばれています。,reason,wikipedia_ja_2_日本語_chunk_141,wikipedia_ja_2_日本語,wikipedia_ja,141,gemini
漢字片仮名交じり文の最古の例は何ですか？,漢字片仮名交じり文の最古の例は『東大寺諷誦文稿』（9世紀）とされています。,fact,wikipedia_ja_2_日本語_chunk_141,wikipedia_ja_2_日本語,wikipedia_ja,141,gemini
漢字片仮名交じり文と平安時代の宮廷文学の文体（和文）の漢語の使用頻度を比較してください。,漢字片仮名交じり文では漢語が多用される一方、平安時代の宮廷文学の文体（和文）では漢語の使用は少ないです。,comparison,wikipedia_ja_2_日本語_chunk_141,wikipedia_ja_2_日本語,wikipedia_ja,141,gemini
「甚ダ広クシテ」という漢文訓読風の言い回しを和文で表現するとどうなりますか？,和文では「いと広う」となります。,application,wikipedia_ja_2_日本語_chunk_141,wikipedia_ja_2_日本語,wikipedia_ja,141,gemini
和文の表記法における特徴は何ですか？,和文は、平仮名に漢字が混じる「平仮名漢字交じり文」です。,fact,wikipedia_ja_2_日本語_chunk_142,wikipedia_ja_2_日本語,wikipedia_ja,142,gemini
和漢混淆文はどのようにして完成しましたか？,和文と漢文の文体が合わさり、『平家物語』に見られるような和漢混淆文が完成しました。,reason,wikipedia_ja_2_日本語_chunk_142,wikipedia_ja_2_日本語,wikipedia_ja,142,gemini
和語が多い文章と漢語が多い文章を比較して、それぞれどのような状況で使用されますか？,和語が多い文章と漢語が多い文章は、適宜混ぜ合わせたり、使い分けたりしながら文章を綴ります。,comparison,wikipedia_ja_2_日本語_chunk_142,wikipedia_ja_2_日本語,wikipedia_ja,142,gemini
現代文で「先日、友人と同道して郊外を散策した」という文を、より口語的な表現に書き換えてください。,「この間、友だちと連れだって町はずれをぶらぶら歩いた」のように書き換えることができます。,application,wikipedia_ja_2_日本語_chunk_142,wikipedia_ja_2_日本語,wikipedia_ja,142,gemini
文語文と口語文で変化の度合いが大きいのはどちらですか？,話し言葉の方が時代と共に変化の度合いが大きいとされています。,fact,wikipedia_ja_2_日本語_chunk_143,wikipedia_ja_2_日本語,wikipedia_ja,143,gemini
日本語の書き言葉が成熟したのはいつ頃ですか？,日本語の書き言葉は平安時代中期にひとまず成熟したと考えられています。,fact,wikipedia_ja_2_日本語_chunk_143,wikipedia_ja_2_日本語,wikipedia_ja,143,gemini
江戸時代の洒落本・滑稽本では、会話部分と地の部分でどのような文体が用いられていますか？,会話部分には当時の話し言葉が強く反映され、地の部分には古来の文法に従おうとした文体が用いられています。,fact,wikipedia_ja_2_日本語_chunk_143,wikipedia_ja_2_日本語,wikipedia_ja,143,gemini
明治時代に現れた「普通文」とはどのような書き言葉ですか？,普通文とは、古典文法に従おうとしつつも、単語には日常語を用いた文章のことです。,fact,wikipedia_ja_2_日本語_chunk_143,wikipedia_ja_2_日本語,wikipedia_ja,143,gemini
文部省が「文法上許容スベキ事項」を告示したのは何年ですか？,1905年（明治38年）です。,fact,wikipedia_ja_2_日本語_chunk_144,wikipedia_ja_2_日本語,wikipedia_ja,144,gemini
言文一致運動において、二葉亭四迷、山田美妙、尾崎紅葉はそれぞれどのような文体を試みましたか？,二葉亭四迷は「だ」体、山田美妙は「です」体、尾崎紅葉は「である」体といわれる文章を試みました。,fact,wikipedia_ja_2_日本語_chunk_144,wikipedia_ja_2_日本語,wikipedia_ja,144,gemini
普通文において、古典文法そのままではない新しい言い方が混ざっていた例を挙げてください。,「解釈せらる」というべきところを「解釈さる」、「就学せしむる義務」を「就学せしむるの義務」などと言うことがありました。,fact,wikipedia_ja_2_日本語_chunk_144,wikipedia_ja_2_日本語,wikipedia_ja,144,gemini
文語文と口語文の違いは何ですか？,文語文は古来の伝統的文法に従った文章であり、口語文は話し言葉を反映した文章です。,comparison,wikipedia_ja_2_日本語_chunk_144,wikipedia_ja_2_日本語,wikipedia_ja,144,gemini
第二次世界大戦後、公文書の書き方はどのように変化しましたか？,第二次世界大戦後は、法律文などの公文書もっぱら口語文で書かれるようになり、文語文は日常生活から遠ざかりました。,fact,wikipedia_ja_2_日本語_chunk_145,wikipedia_ja_2_日本語,wikipedia_ja,145,gemini
国内文献における「方言」という語の最古例は、どの文献に見られますか？,820年頃成立の『東大寺諷誦文稿』に「此当国方言、毛人方言、飛騨方言、東国方言」という記述が見られ、これが国内文献で用いられた「方言」という語の最古例です。,fact,wikipedia_ja_2_日本語_chunk_145,wikipedia_ja_2_日本語,wikipedia_ja,145,gemini
'万葉集'の巻14と巻20には何が記録されていますか？,'万葉集'の巻14「東歌」と巻20「防人歌」には、当時の東国方言による歌が記録されています。,fact,wikipedia_ja_2_日本語_chunk_145,wikipedia_ja_2_日本語,wikipedia_ja,145,gemini
室町時代、地方文献に方言が反映されるようになった理由は何ですか？,室町時代、特に戦国時代には中央の支配力が弱まり地方の力が強まった結果、地方文献に方言が反映されるようになりました。,reason,wikipedia_ja_2_日本語_chunk_145,wikipedia_ja_2_日本語,wikipedia_ja,145,gemini
安土桃山時代から江戸時代初期にかけて、ポルトガル人宣教師が残したキリシタン資料には何が記録されていましたか？,各地の方言が記録されていました。,fact,wikipedia_ja_2_日本語_chunk_146,wikipedia_ja_2_日本語,wikipedia_ja,146,gemini
『日葡辞書』には、どこの言葉が中心に記録されていますか？,京都のことばが中心ですが、九州方言も多数採録されています。,fact,wikipedia_ja_2_日本語_chunk_146,wikipedia_ja_2_日本語,wikipedia_ja,146,gemini
『ロドリゲス日本大文典』には、どの方言の言語的特徴が記されていますか？,筑前や備前など各地の方言の言語的特徴が記されています。,fact,wikipedia_ja_2_日本語_chunk_146,wikipedia_ja_2_日本語,wikipedia_ja,146,gemini
最古期に属する琉球方言（琉球語）の資料は何ですか？,中国資料の『琉球館訳語』です。,fact,wikipedia_ja_2_日本語_chunk_146,wikipedia_ja_2_日本語,wikipedia_ja,146,gemini
琉球の言葉に関する語史の資料として、『おもろさうし』が質・量ともに他を圧倒している理由は何ですか？,『おもろさうし』は、琉球諸島に伝わる古代歌謡・ウムイを集めたものであり、1531年〜1623年という長期間にわたって編纂されたため、質・量ともに充実しているからです。,reason,wikipedia_ja_2_日本語_chunk_147,wikipedia_ja_2_日本語,wikipedia_ja,147,gemini
江戸時代に江戸語の地位が高まった理由は何ですか？,朝廷から徳川家へ征夷大将軍の宣下がなされて以降、江戸文化が開花したことが、江戸語の地位を高めた理由です。,reason,wikipedia_ja_2_日本語_chunk_147,wikipedia_ja_2_日本語,wikipedia_ja,147,gemini
明治時代に東京語が日本語の標準語と見なされるようになったのはなぜですか？,明治時代には、江戸文化が開花し、東京語の地位が高まったため、東京語が日本語の標準語と見なされるようになりました。,reason,wikipedia_ja_2_日本語_chunk_147,wikipedia_ja_2_日本語,wikipedia_ja,147,gemini
明治政府が言葉の統一・標準化を求めたのはなぜですか？,明治政府は、政治的・社会的に全国的な統一を図り、近代国家として外国に対抗するために、言葉の統一・標準化を求めました。,reason,wikipedia_ja_2_日本語_chunk_147,wikipedia_ja_2_日本語,wikipedia_ja,147,gemini
標準語の規範意識確立に伴い、どのような動きが広がりましたか？,方言を矯正しようとする動きが広がりました。,fact,wikipedia_ja_2_日本語_chunk_148,wikipedia_ja_2_日本語,wikipedia_ja,148,gemini
伊沢修二は教員向けにどのようなことをしましたか？,東北方言の矯正法を説いた書物を著しました。,fact,wikipedia_ja_2_日本語_chunk_148,wikipedia_ja_2_日本語,wikipedia_ja,148,gemini
地方の学校では、方言を話した者に対してどのような罰則が行われましたか？,首から「方言札」を下げさせるなどの罰則が行われました。,fact,wikipedia_ja_2_日本語_chunk_148,wikipedia_ja_2_日本語,wikipedia_ja,148,gemini
戦後、方言の録音調査はなぜ行われたのですか？,各地の方言が失われつつあることが危惧されたため、方言の記録を残す目的で行われました。,reason,wikipedia_ja_2_日本語_chunk_148,wikipedia_ja_2_日本語,wikipedia_ja,148,gemini
昭和22年の学習指導要領国語科編（試案）では、国語教育においてどのような方針が示されていたか？,標準語に近づけること、語法の正しいことばを使うことが推奨され、方言や俗語を避けるように記載されていた。,fact,wikipedia_ja_2_日本語_chunk_149,wikipedia_ja_2_日本語,wikipedia_ja,149,gemini
1950年代後半に地方出身者が自殺・事件を起こした理由は何ですか？,地方出身者が自分の言葉を笑われたことが原因で、標準語と方言の軋轢が顕在化した。,reason,wikipedia_ja_2_日本語_chunk_149,wikipedia_ja_2_日本語,wikipedia_ja,149,gemini
戦後の国語教育と昭和33年の小学校学習指導要領では、共通してどのような目標が掲げられていたか？,どちらも全国に通用する言葉（標準語）を習得させることを重視していた。,comparison,wikipedia_ja_2_日本語_chunk_149,wikipedia_ja_2_日本語,wikipedia_ja,149,gemini
もしあなたが1950年代後半の学校の先生だったとして、方言を話す生徒に対してどのような配慮をしますか？,方言を否定するのではなく、標準語も理解できるように促し、生徒が安心して学習できる環境を整えます。,application,wikipedia_ja_2_日本語_chunk_149,wikipedia_ja_2_日本語,wikipedia_ja,149,gemini
1960年代に鎌倉市立腰越小学校で始まった運動の名称は何ですか？,「ネサヨ運動」という名称で、関東方言特有の語尾を使わないようにする運動でした。,fact,wikipedia_ja_2_日本語_chunk_150,wikipedia_ja_2_日本語,wikipedia_ja,150,gemini
