question,answer,question_type,source_chunk_id,doc_id,dataset_type,chunk_idx,provider
普通体の「だ体」と「である体」の違いは何ですか？,普通体で文末に名詞・形容動詞・副詞が来る場合、「だ」または「である」を付けますが、前者を「だ体」、後者を「である体」と呼びます。,comparison,wikipedia_ja_2_日本語_chunk_88,wikipedia_ja_2_日本語,wikipedia_ja,88,gemini
丁寧体を「ですます体」と呼ぶのはなぜですか？,丁寧体では、文末に動詞が来る場合に「ます」を付けるため、「ですます体」と呼ばれることがあります。,reason,wikipedia_ja_2_日本語_chunk_88,wikipedia_ja_2_日本語,wikipedia_ja,88,gemini
文体の位相差はどのような要素によって左右されますか？,文体の位相差は、話し手の性別、年齢、職業、場面などによって左右されます。,fact,wikipedia_ja_2_日本語_chunk_89,wikipedia_ja_2_日本語,wikipedia_ja,89,gemini
「役割語」とはどのような言葉遣いを指しますか？,物語作品やメディアにおいて、位相がステレオタイプ化されたり、仮想的な位相を意図的に作り出されたりする場合の言葉遣いを指します。,definition,wikipedia_ja_2_日本語_chunk_89,wikipedia_ja_2_日本語,wikipedia_ja,89,gemini
丁寧体「ごはんを食べてきました」は、話し手の属性によってどのように変容しますか？例を３つ挙げてください。,子どもや一般人のくだけた文体では「ごはん食べてきたよ」、SNSや学生の粗野な文体では「めし食ってきたぜ」、成人の改まった文体では「食事を取ってまいりました」となります。,comparison,wikipedia_ja_2_日本語_chunk_89,wikipedia_ja_2_日本語,wikipedia_ja,89,gemini
文末に形容詞が来る場合に「です」を避ける例を挙げてください。,「花が美しく咲いています」や「花が美しゅうございます」のように、「です」を避ける表現があります。,fact,wikipedia_ja_2_日本語_chunk_89,wikipedia_ja_2_日本語,wikipedia_ja,89,gemini
役割語はいつ頃から存在すると考えられていますか？,役割語は現代に始まったものではなく、近世や近代の文献にも例が認められます。,fact,wikipedia_ja_2_日本語_chunk_90,wikipedia_ja_2_日本語,wikipedia_ja,90,gemini
なぜ小説やアニメで実際の性別などが反映されない役割語が使われるのですか？,小説やアニメでは、仮想的にそれらしい感じを与える文体として、一般的な位相を反映しない役割語が使われます。,reason,wikipedia_ja_2_日本語_chunk_90,wikipedia_ja_2_日本語,wikipedia_ja,90,gemini
日本語の待遇表現で特に顕著なものは何ですか？,日本語では、相手に敬意を示す言葉（敬語）において待遇表現が顕著です。,fact,wikipedia_ja_2_日本語_chunk_90,wikipedia_ja_2_日本語,wikipedia_ja,90,gemini
与えられたテキストの役割語の例から、特定の職業や身分を表す役割語を1つ挙げてください。,「わしは、食事をしてきたのじゃ。」は、博士風の役割語の例です。,application,wikipedia_ja_2_日本語_chunk_90,wikipedia_ja_2_日本語,wikipedia_ja,90,gemini
日本以外に敬語の文法的・語彙的体系を持つ言語は？,朝鮮語、ジャワ語、ベトナム語、チベット語、ベンガル語、タミル語などがあります。,fact,wikipedia_ja_2_日本語_chunk_91,wikipedia_ja_2_日本語,wikipedia_ja,91,gemini
敬語体系がなくても、敬意を示す表現が必要とされる理由は？,相手を敬い、物を丁寧に言うことは、発達した社会ならばどこでも必要とされるためです。,reason,wikipedia_ja_2_日本語_chunk_91,wikipedia_ja_2_日本語,wikipedia_ja,91,gemini
朝鮮語の動詞「（ネダ）」の敬語形にはどのようなものがあるか？,敬語形として、「（ネシダ）」（出される）と「（ネムニダ）」（出します）の形があります。,fact,wikipedia_ja_2_日本語_chunk_91,wikipedia_ja_2_日本語,wikipedia_ja,91,gemini
もしあなたが外国人に日本語の敬語を教える場合、どのような点に注意すべきですか？,敬語の習得はどの言語でも容易ではないため、学習者の母語の敬語表現と比較しながら、丁寧に教える必要があります。,application,wikipedia_ja_2_日本語_chunk_91,wikipedia_ja_2_日本語,wikipedia_ja,91,gemini
日本語で自分の身内について他人に話す場合、どのような敬語表現を使うべきですか？,自分の身内に対する敬意を他人に表現することは憚られるため、「私の父は…」のように表現する必要があります。,fact,wikipedia_ja_2_日本語_chunk_92,wikipedia_ja_2_日本語,wikipedia_ja,92,gemini
日本語の敬語体系は、一般的にどのような種類に分類されますか？,日本語の敬語体系は、一般に、尊敬語・謙譲語・丁寧語に大きく分類されます。,fact,wikipedia_ja_2_日本語_chunk_92,wikipedia_ja_2_日本語,wikipedia_ja,92,gemini
朝鮮語の敬語と日本語の敬語の違いは何ですか？,朝鮮語では自分の父親に対して常に敬意表現を用いますが、日本語では身内への敬意を他人に示す際は控えるという違いがあります。,comparison,wikipedia_ja_2_日本語_chunk_92,wikipedia_ja_2_日本語,wikipedia_ja,92,gemini
日本語や朝鮮語のような言語で、敬語が文法体系となっていることによって、どのような特徴がありますか？,敬意の種類や度合いに応じた表現の選択肢が予め用意されており、常に適切な表現を選ぶ必要があります。,reason,wikipedia_ja_2_日本語_chunk_92,wikipedia_ja_2_日本語,wikipedia_ja,92,gemini
「敬語の指針」はいつ、誰によって答申されましたか？,2007年2月に文化審議会国語分科会によって答申されました。,fact,wikipedia_ja_2_日本語_chunk_93,wikipedia_ja_2_日本語,wikipedia_ja,93,gemini
尊敬語は、何を高めることで敬意を表しますか？,尊敬語は、動作の主体を高めることで、主体への敬意を表します。,reason,wikipedia_ja_2_日本語_chunk_93,wikipedia_ja_2_日本語,wikipedia_ja,93,gemini
「言う」の尊敬語と謙譲語の例をそれぞれ一つずつ挙げてください。,「言う」の尊敬語は「おっしゃる」であり、謙譲語はテキスト中には明示されていません。,fact,wikipedia_ja_2_日本語_chunk_93,wikipedia_ja_2_日本語,wikipedia_ja,93,gemini
「書く」という動詞を使って、尊敬語の例文を一つ作成してください。,先生が書かれる。,application,wikipedia_ja_2_日本語_chunk_93,wikipedia_ja_2_日本語,wikipedia_ja,93,gemini
「言う」の謙譲語は何ですか？,「言う」の謙譲語は「申し上げる」です。,fact,wikipedia_ja_2_日本語_chunk_94,wikipedia_ja_2_日本語,wikipedia_ja,94,gemini
丁重語とはどのようなものですか？,丁重語は、話題を丁重に表現することで聞き手への敬意を表す表現で、「夜も更けてまいりました」の「まいり」などが例です。,definition,wikipedia_ja_2_日本語_chunk_94,wikipedia_ja_2_日本語,wikipedia_ja,94,gemini
謙譲語と丁重語の違いは何ですか？,謙譲語は主体が下がることで相手への敬意を表しますが、丁重語は話題を丁寧に述べることで敬意を表します。,comparison,wikipedia_ja_2_日本語_chunk_94,wikipedia_ja_2_日本語,wikipedia_ja,94,gemini
「お取りする」は、どの動詞の謙譲語の例ですか？,「お取りする」は、「取る」の謙譲語の例です。,fact,wikipedia_ja_2_日本語_chunk_94,wikipedia_ja_2_日本語,wikipedia_ja,94,gemini
丁重語とはどのようなものですか？,丁重語は、相手とは関わりのない自分側の動作を表現する言い方で、「明日から海外へまいります」の「まいり」などが該当します。,fact,wikipedia_ja_2_日本語_chunk_95,wikipedia_ja_2_日本語,wikipedia_ja,95,gemini
丁寧語の主な役割は何ですか？,丁寧語は、文末を丁寧にすることで聞き手への敬意を表す役割を果たします。,reason,wikipedia_ja_2_日本語_chunk_95,wikipedia_ja_2_日本語,wikipedia_ja,95,gemini
常体と敬体の違いは何ですか？,常体は動詞・形容詞が終止形で終わるのに対し、敬体は名詞・形容動詞語幹に「です」を付けたり、動詞に「ます」をつけたりします。,comparison,wikipedia_ja_2_日本語_chunk_95,wikipedia_ja_2_日本語,wikipedia_ja,95,gemini
丁寧語が敬意や謝意の表現以外に用いられるのはどのような場合ですか？,丁寧語は、稀に相手との心理的な距離をとろうとする場合にも用いられます。,application,wikipedia_ja_2_日本語_chunk_95,wikipedia_ja_2_日本語,wikipedia_ja,95,gemini
宮地裕は「お弁当」などの「お」「ご」を何と称して区別しているか？,宮地裕は「お弁当」などの「お」「ご」を「美化語」と称して区別している。,fact,wikipedia_ja_2_日本語_chunk_96,wikipedia_ja_2_日本語,wikipedia_ja,96,gemini
美化語が丁寧語と区別される理由は何ですか？,美化語は相手への丁寧の意を示すというより、話し手が自分の言葉遣いに配慮した表現だからです。,reason,wikipedia_ja_2_日本語_chunk_96,wikipedia_ja_2_日本語,wikipedia_ja,96,gemini
「課長もコーヒーをお飲みになりたいですか」という表現が敬意表現として不適切な理由は何ですか？,日本語では相手の意向を直接的に聞くことは失礼にあたると考えられるからです。,reason,wikipedia_ja_2_日本語_chunk_96,wikipedia_ja_2_日本語,wikipedia_ja,96,gemini
敬意表現において、文法・語彙の知識以外に必要なことは何ですか？,時や場合など種々の要素に配慮した適切な表現を選ぶことが必要です。,application,wikipedia_ja_2_日本語_chunk_96,wikipedia_ja_2_日本語,wikipedia_ja,96,gemini
第22期国語審議会はいつ、「現代社会における敬意表現」を答申しましたか？,2000年に答申しました。,fact,wikipedia_ja_2_日本語_chunk_97,wikipedia_ja_2_日本語,wikipedia_ja,97,gemini
婉曲表現が敬意表現として用いられる例を挙げてください。,相手に窓を開けてほしい場合に、「窓を開けてくれる？」と問いかけ表現を用いることが挙げられます。,application,wikipedia_ja_2_日本語_chunk_97,wikipedia_ja_2_日本語,wikipedia_ja,97,gemini
日本人が商取引で「考えさせてもらいます」と言う場合、どのような意味を持つことが多いですか？,拒絶の意味であると言われることが多いです。,fact,wikipedia_ja_2_日本語_chunk_97,wikipedia_ja_2_日本語,wikipedia_ja,97,gemini
京都の「ぶぶづけ」の例は、広義の敬意表現と言えるのはなぜですか？,相手の気分を害さないように工夫した表現であるという意味において、広義の敬意表現と呼ぶことができます。,reason,wikipedia_ja_2_日本語_chunk_97,wikipedia_ja_2_日本語,wikipedia_ja,97,gemini
日本語の方言は、どのような基準によって方言圏を区画できますか？,方言圏の区画は、用いる指標によって異なり、明確な境界線はありません。,fact,wikipedia_ja_2_日本語_chunk_98,wikipedia_ja_2_日本語,wikipedia_ja,98,gemini
1967年の調査で、関東地方出身者にとって最も理解しにくい方言は何でしたか？,琉球諸語と東北方言を除くと、富山県氷見方言が最も理解しにくい方言でした（正解率4.1%）。,fact,wikipedia_ja_2_日本語_chunk_98,wikipedia_ja_2_日本語,wikipedia_ja,98,gemini
1967年の相互理解可能性の調査は、どのような方法で行われましたか？,12〜20秒の長さの老人の録音を、関東地方で育った慶應大学の学生42名が聞いて翻訳しました。,fact,wikipedia_ja_2_日本語_chunk_98,wikipedia_ja_2_日本語,wikipedia_ja,98,gemini
東条操は、全国で話されている言葉をどのように分類しましたか？,東条操は、全国の言葉を東部方言・西部方言・九州方言・琉球方言の4つに大きく分けました。,fact,wikipedia_ja_2_日本語_chunk_98,wikipedia_ja_2_日本語,wikipedia_ja,98,gemini
現在でも一般的に用いられる方言の区画は、どのような地域に基づいているか？,北海道から先島諸島まで、細かく区画された地域に基づいている。,fact,wikipedia_ja_2_日本語_chunk_99,wikipedia_ja_2_日本語,wikipedia_ja,99,gemini
奄美・沖縄・先島の言葉は、日本語の方言として扱われる場合と、独立した言語として扱われる場合があるが、それぞれの立場を何と呼ぶか？,日本語の一方言とする立場を琉球方言と呼び、独立言語とする立場を琉球語と呼ぶ。,comparison,wikipedia_ja_2_日本語_chunk_99,wikipedia_ja_2_日本語,wikipedia_ja,99,gemini
金田一春彦の方言区画は、どのような特徴に着目して分類されたか？,アクセントや音韻、文法の特徴が畿内を中心に輪を描くことに着目して分類された。,reason,wikipedia_ja_2_日本語_chunk_99,wikipedia_ja_2_日本語,wikipedia_ja,99,gemini
金田一春彦の方言区画において、近畿・四国地方は主に何という方言に分類されるか？,近畿・四国地方は、主に内輪方言に分類される。,fact,wikipedia_ja_2_日本語_chunk_99,wikipedia_ja_2_日本語,wikipedia_ja,99,gemini
奈良県の方言は近畿方言に属するが、十津川村や下北山村周辺のアクセントの特徴は？,十津川村や下北山村周辺では、近畿方言の地域でありながら東京式アクセントが使われている。,fact,wikipedia_ja_2_日本語_chunk_100,wikipedia_ja_2_日本語,wikipedia_ja,100,gemini
香川県観音寺市伊吹町（伊吹島）の方言には、どのような特徴が残存していると言われているか？,平安時代のアクセント体系が残存していると言われている（異説もある）。,fact,wikipedia_ja_2_日本語_chunk_100,wikipedia_ja_2_日本語,wikipedia_ja,100,gemini
東部方言と西部方言の否定辞の違いは？,東部方言では「ナイ」を、西部方言では「ン」を用いる。,comparison,wikipedia_ja_2_日本語_chunk_100,wikipedia_ja_2_日本語,wikipedia_ja,100,gemini
東部方言と西部方言の完了形の表現の違いは？,東部方言では「テル」を、西部方言では「トル」を用いる。,comparison,wikipedia_ja_2_日本語_chunk_100,wikipedia_ja_2_日本語,wikipedia_ja,100,gemini
アワ行五段活用の動詞連用形は、東と西でどのように変化しますか？,東日本では促音便（例：カッタ）、西日本ではウ音便（例：コータ）になります。,fact,wikipedia_ja_2_日本語_chunk_101,wikipedia_ja_2_日本語,wikipedia_ja,101,gemini
形容詞連用形は、東と西でどのような違いがありますか？,東日本では非音便形（例：ハヤク）、西日本ではウ音便形（例：ハヨー）が用いられる傾向があります。,comparison,wikipedia_ja_2_日本語_chunk_101,wikipedia_ja_2_日本語,wikipedia_ja,101,gemini
東西方言の境界線として一般的にどこが挙げられますか？,日本海側は新潟県糸魚川市、太平洋側は静岡県浜名湖が境界線とされます（糸魚川・浜名湖線）。,fact,wikipedia_ja_2_日本語_chunk_101,wikipedia_ja_2_日本語,wikipedia_ja,101,gemini
糸魚川・浜名湖線が東西方言の境界線となった理由の一つは何ですか？,糸魚川西方には難所親不知があり、その南には日本アルプスが連なり、東西の交通を妨げていたことが一因と考えられます。,reason,wikipedia_ja_2_日本語_chunk_101,wikipedia_ja_2_日本語,wikipedia_ja,101,gemini
東京式アクセントと京阪式アクセントの主な違いは何ですか？,東京式は下がり目の位置のみを弁別しますが、京阪式は下がり目の位置に加え第1拍の高低も弁別します。,comparison,wikipedia_ja_2_日本語_chunk_102,wikipedia_ja_2_日本語,wikipedia_ja,102,gemini
日本語の標準語・共通語のアクセントは、なぜ東京式アクセントなのですか？,東京の山の手言葉のアクセントを基盤としているため、東京式アクセントが採用されています。,reason,wikipedia_ja_2_日本語_chunk_102,wikipedia_ja_2_日本語,wikipedia_ja,102,gemini
京阪式アクセントは主にどの地域に分布していますか？,京阪式アクセントは、近畿地方と四国地方のそれぞれ大部分、および北陸地方の一部に分布しています。,fact,wikipedia_ja_2_日本語_chunk_102,wikipedia_ja_2_日本語,wikipedia_ja,102,gemini
九州西南部や沖縄の一部に見られる二型アクセントとはどのようなものですか？,二型アクセントとは、アクセントの型の種類が2種類になっているアクセントのことです。,fact,wikipedia_ja_2_日本語_chunk_102,wikipedia_ja_2_日本語,wikipedia_ja,102,gemini
音の上がり目を弁別するアクセントを持つ地域はどこですか？,岩手県雫石町や山梨県早川町奈良田などの地域では、音の下がり目ではなく上がり目を弁別するアクセントが用いられています。,fact,wikipedia_ja_2_日本語_chunk_103,wikipedia_ja_2_日本語,wikipedia_ja,103,gemini
無アクセント（崩壊アクセント）の地域はどのような特徴がありますか？,無アクセントの地域では、話者にアクセントの知覚がなく、どこを高くするという決まりがありません。,fact,wikipedia_ja_2_日本語_chunk_103,wikipedia_ja_2_日本語,wikipedia_ja,103,gemini
東京と京都で「花が」のアクセントが異なるのはなぜですか？,単語のアクセントは地方によって異なり、「花が」は東京で「低高低」、京都で「高低低」と発音されます。,fact,wikipedia_ja_2_日本語_chunk_103,wikipedia_ja_2_日本語,wikipedia_ja,103,gemini
地方のアクセント体系は互いにどのような関係にありますか？,地方のアクセント体系は互いにまったく無関係ではなく、多くの場合において規則的な対応が見られます。,fact,wikipedia_ja_2_日本語_chunk_103,wikipedia_ja_2_日本語,wikipedia_ja,103,gemini
東京と京都における「花が」「山が」「池が」の発音の違いは何ですか？,東京では「低高低」と発音するのに対し、京都では「高低低」と発音します。,fact,wikipedia_ja_2_日本語_chunk_104,wikipedia_ja_2_日本語,wikipedia_ja,104,gemini
ある地方で同じアクセントの型にまとめられる語群が、他の地方でも同じ型に属することが観察される事実は、何を示唆していますか？,日本の方言アクセントが、過去の同一のアクセント体系から分かれ出たことを示唆しています。,reason,wikipedia_ja_2_日本語_chunk_104,wikipedia_ja_2_日本語,wikipedia_ja,104,gemini
服部四郎は、東京式アクセントと京阪式アクセントの関係について、どのような仮説を立てましたか？,原始日本語のアクセントが分岐し、互いに反対の方向に変化して、東京式と京阪式を生じたと考えました。,fact,wikipedia_ja_2_日本語_chunk_104,wikipedia_ja_2_日本語,wikipedia_ja,104,gemini
東京式アクセントと京阪式アクセントの違いは、具体的な単語の発音においてどのように現れますか？例を挙げて説明してください。,例えば、「松が」「空が」「海が」は東京では「高低低」ですが、京都では「低低高」と発音されます。,comparison,wikipedia_ja_2_日本語_chunk_104,wikipedia_ja_2_日本語,wikipedia_ja,104,gemini
日本語アクセントの祖体系として有力な説は何ですか？,院政期の京阪式アクセント（名義抄式アクセント）が祖体系であり、現在の諸方言アクセントはこれが変化した結果であるという説が有力です。,fact,wikipedia_ja_2_日本語_chunk_105,wikipedia_ja_2_日本語,wikipedia_ja,105,gemini
本土方言は発音の特徴によってどのように区分できますか？,表日本方言、裏日本方言、薩隅（鹿児島）式方言の3つに大きく区分できます。,fact,wikipedia_ja_2_日本語_chunk_105,wikipedia_ja_2_日本語,wikipedia_ja,105,gemini
裏日本式の音韻体系を持つ地域の特徴は何ですか？,イ段とウ段の母音に中舌母音を用い、エが狭くイに近いことが特徴です。,fact,wikipedia_ja_2_日本語_chunk_105,wikipedia_ja_2_日本語,wikipedia_ja,105,gemini
なぜ、諸方言のアクセントは京阪式アクセントとの接触で生じたという説があるのですか？,地方の無アクセント地域と中央の京阪式アクセントが接触することで、新しいアクセントが生じる可能性があるからです。,reason,wikipedia_ja_2_日本語_chunk_105,wikipedia_ja_2_日本語,wikipedia_ja,105,gemini
薩隅式方言は、他方言と比べてどのような点で対立していますか？,薩隅式方言は、大量の母音脱落により閉音節を多く持っている点で、他の方言と対立しています。,comparison,wikipedia_ja_2_日本語_chunk_106,wikipedia_ja_2_日本語,wikipedia_ja,106,gemini
薩隅方言以外の九州の方言は、どのような方言の中間であると言えますか？,薩隅方言以外の九州の方言は、薩隅式と表日本式の中間であると言えます。,fact,wikipedia_ja_2_日本語_chunk_106,wikipedia_ja_2_日本語,wikipedia_ja,106,gemini
東日本、北陸、出雲付近で発音される母音の「う」は、どのような特徴がありますか？,これらの地域で発音される母音の「う」は、中舌寄りで非円唇母音（唇を丸めない）であるという特徴があります。,fact,wikipedia_ja_2_日本語_chunk_106,wikipedia_ja_2_日本語,wikipedia_ja,106,gemini
近畿・四国地方では、アクセント以外にどのような共通点がありますか？,近畿・四国地方では、一音節語を伸ばして二拍に発音したり、「赤い」→「あけー」のような連母音の融合が起こらないといった共通点があります。,fact,wikipedia_ja_2_日本語_chunk_106,wikipedia_ja_2_日本語,wikipedia_ja,106,gemini
西日本と東日本では、発音においてどのような違いがありますか？,西日本（九州・山陰・北陸除く）は母音を強く子音を弱く発音する傾向があり、東日本や九州は子音を強く母音を弱く発音する傾向があります。,comparison,wikipedia_ja_2_日本語_chunk_107,wikipedia_ja_2_日本語,wikipedia_ja,107,gemini
橋本進吉は何の研究を再評価しましたか？,橋本進吉は、江戸時代の上代特殊仮名遣いの研究を再評価しました。,fact,wikipedia_ja_2_日本語_chunk_107,wikipedia_ja_2_日本語,wikipedia_ja,107,gemini
橋本進吉は、万葉仮名においてどのような指摘をしましたか？,橋本進吉は、「き・ひ・み・け・へ・め・こ・そ・と・の・も・よ・ろ」の表記に2種類の仮名が存在することを指摘しました（甲類・乙類）。,fact,wikipedia_ja_2_日本語_chunk_107,wikipedia_ja_2_日本語,wikipedia_ja,107,gemini
橋本進吉は、甲類・乙類の仮名の区別は何に基づくと考えましたか？,橋本進吉は、甲類・乙類の仮名の区別は音韻上の区別、特に母音の差によるものと考えました。,reason,wikipedia_ja_2_日本語_chunk_107,wikipedia_ja_2_日本語,wikipedia_ja,107,gemini
橋本の説に基づくと、上代日本語の母音の数はいくつとされていますか？,橋本の説は、後続の研究者によって8母音説として受け取られ、定説化しました。,fact,wikipedia_ja_2_日本語_chunk_108,wikipedia_ja_2_日本語,wikipedia_ja,108,gemini
平安時代には、上代日本語の8母音の区別はどうなりましたか？,平安時代には8母音の区別がなくなり、現在のように5母音になったと考えられています。,fact,wikipedia_ja_2_日本語_chunk_108,wikipedia_ja_2_日本語,wikipedia_ja,108,gemini
上代日本語の語彙における母音の出現の仕方は、どのような言語の法則に類似しているとされていますか？,上代日本語の語彙では、母音の出現の仕方がウラル語族やアルタイ語族の母音調和の法則に類似しているとされています。,fact,wikipedia_ja_2_日本語_chunk_108,wikipedia_ja_2_日本語,wikipedia_ja,108,gemini
奈良時代以前の「は行」の子音は、どのような発音だったと推定されていますか？,奈良時代以前の「は行」の子音は、であったとみられ、「はな」は（パナ）のように発音された可能性があります。,fact,wikipedia_ja_2_日本語_chunk_108,wikipedia_ja_2_日本語,wikipedia_ja,108,gemini
